{"meta":{"version":1,"request":"http://nba.cloud/league/10/2026/scheduleleaguev2?Format=json","time":"2026-02-03T14:12:54.1254Z"},"leagueSchedule":{"seasonYear":"2026","leagueId":"10","gameDates":[{"gameDate":"04/25/2026 00:00:00","games":[]},{"gameDate":"04/30/2026 00:00:00","games":[]},{"gameDate":"05/08/2026 00:00:00","games":[{"gameId":"1022600001","gameCode":"20260508/CONNYL","gameStatus":1,"gameStatusText":"7:30 pm ET","gameSequence":1,"gameDateEst":"2026-05-08T00:00:00Z","gameTimeEst":"1900-01-01T19:30:00Z","gameDateTimeEst":"2026-05-08T19:30:00Z","gameDateUTC":"2026-05-08T04:00:00Z","gameTimeUTC":"1900-01-01T23:30:00Z","gameDateTimeUTC":"2026-05-08T23:30:00Z","awayTeamTime":"2026-05-08T19:30:00Z","homeTeamTime":"2026-05-08T19:30:00Z","day":"Fri","monthNum":5,"weekNumber":0,"weekName":"","ifNecessary":false,"seriesGameNumber":"","gameLabel":"","gameSubLabel":"","seriesText":"","arenaName":"Barclays Center","arenaState":"NY","arenaCity":"Brooklyn","postponedStatus":"N","branchLink":"","gameSubtype":"","isNeutral":false,"broadcasters":{"nationalBroadcasters":[],"nationalRadioBroadcasters":[],"nationalOttBroadcasters":[],"homeTvBroadcasters":[],"homeRadioBroadcasters":[],"homeOttBroadcasters":[],"awayTvBroadcasters":[],"awayRadioBroadcasters":[],"awayOttBroadcasters":[]},"homeTeam":{"teamId":1611661313,"teamName":"Liberty","teamCity":"New York","teamTricode":"NYL","teamSlug":"liberty","wins":0,"losses":0,"score":0,"seed":0},"awayTeam":{"teamId":1611661323,"teamName":"Sun","teamCity":"Connecticut","teamTricode":"CON","teamSlug":"sun","wins":0,"losses":0,"score":0,"seed":0},"pointsLeaders":[]},{"gameId":"1022600003","gameCode":"20260508/GSVSEA","gameStatus":1,"gameStatusText":"10:00 pm ET","gameSequence":3,"gameDateEst":"2026-05-08T00:00:00Z","gameTimeEst":"1900-01-01T22:00:00Z","gameDateTimeEst":"2026-05-08T22:00:00Z","gameDateUTC":"2026-05-08T04:00:00Z","gameTimeUTC":"1900-01-01T02:00:00Z","gameDateTimeUTC":"2026-05-09T02:00:00Z","awayTeamTime":"2026-05-08T19:00:00Z","homeTeamTime":"2026-05-08T19:00:00Z","day":"Fri","monthNum":5,"weekNumber":0,"weekName":"","ifNecessary":false,"seriesGameNumber":"","gameLabel":"","gameSubLabel":"","seriesText":"","arenaName":"Climate Pledge Arena","arenaState":"WA","arenaCity":"Seattle","postponedStatus":"N","branchLink":"","gameSubtype":"","isNeutral":false,"broadcasters":{"nationalBroadcasters":[],"nationalRadioBroadcasters":[],"nationalOttBroadcasters":[],"homeTvBroadcasters":[],"homeRadioBroadcasters":[],"homeOttBroadcasters":[],"awayTvBroadcasters":[],"awayRadioBroadcasters":[],"awayOttBroadcasters":[]},"homeTeam":{"teamId":1611661328,"teamName":"Storm","teamCity":"Seattle","teamTricode":"SEA","teamSlug":"storm","wins":0,"losses":0,"score":0,"seed":0},"awayTeam":{"teamId":1611661331,"teamName":"Valkyries","teamCity":"Golden State","teamTricode":"GSV","teamSlug":"valkyries","wins":0,"losses":0,"score":0,"seed":0},"pointsLeaders":[]}]},{"gameDate":"05/09/2026 00:00:00","games":[{"gameId":"1022600004","gameCode":"20260509/DALIND","gameStatus":1,"gameStatusText":"1:00 pm ET","gameSequence":1,"gameDateEst":"2026-05-09T00:00:00Z","gameTimeEst":"1900-01-01T13:00:00Z","gameDateTimeEst":"2026-05-09T13:00:00Z","gameDateUTC":"2026-05-09T04:00:00Z","gameTimeUTC":"1900-01-01T17:00:00Z","gameDateTimeUTC":"2026-05-09T17:00:00Z","awayTeamTime":"2026-05-09T12:00:00Z","homeTeamTime":"2026-05-09T13:00:00Z","day":"Sat","monthNum":5,"weekNumber":0,"weekName":"","ifNecessary":false,"seriesGameNumber":"","gameLabel":"","gameSubLabel":"","seriesText":"","arenaName":"Gainbridge Fieldhouse","arenaState":"IN","arenaCity":"Indianapolis","postponedStatus":"N","branchLink":"","gameSubtype":"","isNeutral":false,"broadcasters":{"nationalBroadcasters":[],"nationalRadioBroadcasters":[],"nationalOttBroadcasters":[],"homeTvBroadcasters":[],"homeRadioBroadcasters":[],"homeOttBroadcasters":[],"awayTvBroadcasters":[],"awayRadioBroadcasters":[],"awayOttBroadcasters":[]},"homeTeam":{"teamId":1611661325,"teamName":"Fever","teamCity":"Indiana","teamTricode":"IND","teamSlug":"fever","wins":0,"losses":0,"score":0,"seed":0},"awayTeam":{"teamId":1611661321,"teamName":"Wings","teamCity":"Dallas","teamTricode":"DAL","teamSlug":"wings","wins":0,"losses":0,"score":0,"seed":0},"pointsLeaders":[]},{"gameId":"1022600005","gameCode":"20260509/PHXLVA","gameStatus":1,"gameStatusText":"3:30 pm ET","gameSequence":2,"gameDateEst":"2026-05-09T00:00:00Z","gameTimeEst":"1900-01-01T15:30:00Z","gameDateTimeEst":"2026-05-09T15:30:00Z","gameDateUTC":"2026-05-09T04:00:00Z","gameTimeUTC":"1900-01-01T19:30:00Z","gameDateTimeUTC":"2026-05-09T19:30:00Z","awayTeamTime":"2026-05-09T12:30:00Z","homeTeamTime":"2026-05-09T12:30:00Z","day":"Sat","monthNum":5,"weekNumber":0,"weekName":"","ifNecessary":false,"seriesGameNumber":"","gameLabel":"","gameSubLabel":"","seriesText":"","arenaName":"T-Mobile Arena","arenaState":"NV","arenaCity":"Las Vegas","postponedStatus":"N","branchLink":"","gameSubtype":"","isNeutral":false,"broadcasters":{"nationalBroadcasters":[],"nationalRadioBroadcasters":[],"nationalOttBroadcasters":[],"homeTvBroadcasters":[],"homeRadioBroadcasters":[],"homeOttBroadcasters":[],"awayTvBroadcasters":[],"awayRadioBroadcasters":[],"awayOttBroadcasters":[]},"homeTeam":{"teamId":1611661319,"teamName":"Aces","teamCity":"Las Vegas","teamTricode":"LVA","teamSlug":"aces","wins":0,"losses":0,"score":0,"seed":0},"awayTeam":{"teamId":1611661317,"teamName":"Mercury","teamCity":"Phoenix","teamTricode":"PHX","teamSlug":"mercury","wins":0,"losses":0,"score":0,"seed":0},"pointsLeaders":[]}]},{"gameDate":"05/10/2026 00:00:00","games":[{"gameId":"1022600007","gameCode":"20260510/SEACON","gameStatus":1,"gameStatusText":"1:00 pm ET","gameSequence":1,"gameDateEst":"2026-05-10T00:00:00Z","gameTimeEst":"1900-01-01T13:00:00Z","gameDateTimeEst":"2026-05-10T13:00:00Z","gameDateUTC":"2026-05-10T04:00:00Z","gameTimeUTC":"1900-01-01T17:00:00Z","gameDateTimeUTC":"2026-05-10T17:00:00Z","awayTeamTime":"2026-05-10T10:00:00Z","homeTeamTime":"2026-05-10T13:00:00Z","day":"Sun","monthNum":5,"weekNumber":0,"weekName":"","ifNecessary":false,"seriesGameNumber":"","gameLabel":"","gameSubLabel":"","seriesText":"","arenaName":"Mohegan Sun Arena","arenaState":"CT","arenaCity":"Uncasville","postponedStatus":"N","branchLink":"","gameSubtype":"","isNeutral":false,"broadcasters":{"nationalBroadcasters":[],"nationalRadioBroadcasters":[],"nationalOttBroadcasters":[],"homeTvBroadcasters":[],"homeRadioBroadcasters":[],"homeOttBroadcasters":[],"awayTvBroadcasters":[],"awayRadioBroadcasters":[],"awayOttBroadcasters":[]},"homeTeam":{"teamId":1611661323,"teamName":"Sun","teamCity":"Connecticut","teamTricode":"CON","teamSlug":"sun","wins":0,"losses":0,"score":0,"seed":0},"awayTeam":{"teamId":1611661328,"teamName":"Storm","teamCity":"Seattle","teamTricode":"SEA","teamSlug":"storm","wins":0,"losses":0,"score":0,"seed":0},"pointsLeaders":[]},{"gameId":"1022600008","gameCode":"20260510/NYLWAS","gameStatus":1,"gameStatusText":"3:00 pm ET","gameSequence":2,"gameDateEst":"2026-05-10T00:00:00Z","gameTimeEst":"1900-01-01T15:00:00Z","gameDateTimeEst":"2026-05-10T15:00:00Z","gameDateUTC":"2026-05-10T04:00:00Z","gameTimeUTC":"1900-01-01T19:00:00Z","gameDateTimeUTC":"2026-05-10T19:00:00Z","awayTeamTime":"2026-05-10T15:00:00Z","homeTeamTime":"2026-05-10T15:00:00Z","day":"Sun","monthNum":5,"weekNumber":0,"weekName":"","ifNecessary":false,"seriesGameNumber":"","gameLabel":"","gameSubLabel":"","seriesText":"","arenaName":"CareFirst Arena","arenaState":"DC","arenaCity":"Washington","postponedStatus":"N","branchLink":"","gameSubtype":"","isNeutral":false,"broadcasters":{"nationalBroadcasters":[],"nationalRadioBroadcasters":[],"nationalOttBroadcasters":[],"homeTvBroadcasters":[],"homeRadioBroadcasters":[],"homeOttBroadcasters":[],"awayTvBroadcasters":[],"awayRadioBroadcasters":[],"awayOttBroadcasters":[]},"homeTeam":{"teamId":1611661322,"teamName":"Mystics","teamCity":"Washington","teamTricode":"WAS","teamSlug":"mystics","wins":0,"losses":0,"score":0,"seed":0},"awayTeam":{"teamId":1611661313,"teamName":"Liberty","teamCity":"New York","teamTricode":"NYL","teamSlug":"liberty","wins":0,"losses":0,"score":0,"seed":0},"pointsLeaders":[]},{"gameId":"1022600009","gameCode":"20260510/LVALAS","gameStatus":1,"gameStatusText":"6:00 pm ET","gameSequence":3,"gameDateEst":"2026-05-10T00:00:00Z","gameTimeEst":"1900-01-01T18:00:00Z","gameDateTimeEst":"2026-05-10T18:00:00Z","gameDateUTC":"2026-05-10T04:00:00Z","gameTimeUTC":"1900-01-01T22:00:00Z","gameDateTimeUTC":"2026-05-10T22:00:00Z","awayTeamTime":"2026-05-10T15:00:00Z","homeTeamTime":"2026-05-10T15:00:00Z","day":"Sun","monthNum":5,"weekNumber":0,"weekName":"","ifNecessary":false,"seriesGameNumber":"","gameLabel":"","gameSubLabel":"","seriesText":"","arenaName":"Crypto.com Arena","arenaState":"CA","arenaCity":"Los Angeles","postponedStatus":"N","branchLink":"","gameSubtype":"","isNeutral":false,"broadcasters":{"nationalBroadcasters":[],"nationalRadioBroadcasters":[],"nationalOttBroadcasters":[],"homeTvBroadcasters":[],"homeRadioBroadcasters":[],"homeOttBroadcasters":[],"awayTvBroadcasters":[],"awayRadioBroadcasters":[],"awayOttBroadcasters":[]},"homeTeam":{"teamId":1611661320,"teamName":"Sparks","teamCity":"Los Angeles","teamTricode":"LAS","teamSlug":"sparks","wins":0,"losses":0,"score":0,"seed":0},"awayTeam":{"teamId":1611661319,"teamName":"Aces","teamCity":"Las Vegas","teamTricode":"LVA","teamSlug":"aces","wins":0,"losses":0,"score":0,"seed":0},"pointsLeaders":[]},{"gameId":"1022600010","gameCode":"20260510/ATLMIN","gameStatus":1,"gameStatusText":"7:00 pm ET","gameSequence":4,"gameDateEst":"2026-05-10T00:00:00Z","gameTimeEst":"1900-01-01T19:00:00Z","gameDateTimeEst":"2026-05-10T19:00:00Z","gameDateUTC":"2026-05-10T04:00:00Z","gameTimeUTC":"1900-01-01T23:00:00Z","gameDateTimeUTC":"2026-05-10T23:00:00Z","awayTeamTime":"2026-05-10T19:00:00Z","homeTeamTime":"2026-05-10T18:00:00Z","day":"Sun","monthNum":5,"weekNumber":0,"weekName":"","ifNecessary":false,"seriesGameNumber":"","gameLabel":"","gameSubLabel":"","seriesText":"","arenaName":"Target Center","arenaState":"MN","arenaCity":"Minneapolis","postponedStatus":"N","branchLink":"","gameSubtype":"","isNeutral":false,"broadcasters":{"nationalBroadcasters":[],"nationalRadioBroadcasters":[],"nationalOttBroadcasters":[],"homeTvBroadcasters":[],"homeRadioBroadcasters":[],"homeOttBroadcasters":[],"awayTvBroadcasters":[],"awayRadioBroadcasters":[],"awayOttBroadcasters":[]},"homeTeam":{"teamId":1611661324,"teamName":"Lynx","teamCity":"Minnesota","teamTricode":"MIN","teamSlug":"lynx","wins":0,"losses":0,"score":0,"seed":0},"awayTeam":{"teamId":1611661330,"teamName":"Dream","teamCity":"Atlanta","teamTricode":"ATL","teamSlug":"dream","wins":0,"losses":0,"score":0,"seed":0},"pointsLeaders":[]},{"gameId":"1022600011","gameCode":"20260510/PHXGSV","gameStatus":1,"gameStatusText":"8:30 pm ET","gameSequence":5,"gameDateEst":"2026-05-10T00:00:00Z","gameTimeEst":"1900-01-01T20:30:00Z","gameDateTimeEst":"2026-05-10T20:30:00Z","gameDateUTC":"2026-05-10T04:00:00Z","gameTimeUTC":"1900-01-01T00:30:00Z","gameDateTimeUTC":"2026-05-11T00:30:00Z","awayTeamTime":"2026-05-10T17:30:00Z","homeTeamTime":"2026-05-10T17:30:00Z","day":"Sun","monthNum":5,"weekNumber":0,"weekName":"","ifNecessary":false,"seriesGameNumber":"","gameLabel":"","gameSubLabel":"","seriesText":"","arenaName":"Chase Center","arenaState":"CA","arenaCity":"San Francisco","postponedStatus":"N","branchLink":"","gameSubtype":"","isNeutral":false,"broadcasters":{"nationalBroadcasters":[],"nationalRadioBroadcasters":[],"nationalOttBroadcasters":[],"homeTvBroadcasters":[],"homeRadioBroadcasters":[],"homeOttBroadcasters":[],"awayTvBroadcasters":[],"awayRadioBroadcasters":[],"awayOttBroadcasters":[]},"homeTeam":{"teamId":1611661331,"teamName":"Valkyries","teamCity":"Golden State","teamTricode":"GSV","teamSlug":"valkyries","wins":0,"losses":0,"score":0,"seed":0},"awayTeam":{"teamId":1611661317,"teamName":"Mercury","teamCity":"Phoenix","teamTricode":"PHX","teamSlug":"mercury","wins":0,"losses":0,"score":0,"seed":0},"pointsLeaders":[]}]},{"gameDate":"05/12/2026 00:00:00","games":[{"gameId":"1022600012","gameCode":"20260512/ATLDAL","gameStatus":1,"gameStatusText":"8:00 pm ET","gameSequence":1,"gameDateEst":"2026-05-12T00:00:00Z","gameTimeEst":"1900-01-01T20:00:00Z","gameDateTimeEst":"2026-05-12T20:00:00Z","gameDateUTC":"2026-05-12T04:00:00Z","gameTimeUTC":"1900-01-01T00:00:00Z","gameDateTimeUTC":"2026-05-13T00:00:00Z","awayTeamTime":"2026-05-12T20:00:00Z","homeTeamTime":"2026-05-12T19:00:00Z","day":"Tue","monthNum":5,"weekNumber":0,"weekName":"","ifNecessary":false,"seriesGameNumber":"","gameLabel":"","gameSubLabel":"","seriesText":"","arenaName":"College Park Center","arenaState":"TX","arenaCity":"Arlington","postponedStatus":"N","branchLink":"","gameSubtype":"","isNeutral":false,"broadcasters":{"nationalBroadcasters":[],"nationalRadioBroadcasters":[],"nationalOttBroadcasters":[],"homeTvBroadcasters":[],"homeRadioBroadcasters":[],"homeOttBroadcasters":[],"awayTvBroadcasters":[],"awayRadioBroadcasters":[],"awayOttBroadcasters":[]},"homeTeam":{"teamId":1611661321,"teamName":"Wings","teamCity":"Dallas","teamTricode":"DAL","teamSlug":"wings","wins":0,"losses":0,"score":0,"seed":0},"awayTeam":{"teamId":1611661330,"teamName":"Dream","teamCity":"Atlanta","teamTricode":"ATL","teamSlug":"dream","wins":0,"losses":0,"score":0,"seed":0},"pointsLeaders":[]},{"gameId":"1022600013","gameCode":"20260512/MINPHX","gameStatus":1,"gameStatusText":"10:00 pm ET","gameSequence":2,"gameDateEst":"2026-05-12T00:00:00Z","gameTimeEst":"1900-01-01T22:00:00Z","gameDateTimeEst":"2026-05-12T22:00:00Z","gameDateUTC":"2026-05-12T04:00:00Z","gameTimeUTC":"1900-01-01T02:00:00Z","gameDateTimeUTC":"2026-05-13T02:00:00Z","awayTeamTime":"2026-05-12T21:00:00Z","homeTeamTime":"2026-05-12T19:00:00Z","day":"Tue","monthNum":5,"weekNumber":0,"weekName":"","ifNecessary":false,"seriesGameNumber":"","gameLabel":"","gameSubLabel":"","seriesText":"","arenaName":"Mortgage Matchup Center","arenaState":"AZ","arenaCity":"Phoenix","postponedStatus":"N","branchLink":"","gameSubtype":"","isNeutral":false,"broadcasters":{"nationalBroadcasters":[],"nationalRadioBroadcasters":[],"nationalOttBroadcasters":[],"homeTvBroadcasters":[],"homeRadioBroadcasters":[],"homeOttBroadcasters":[],"awayTvBroadcasters":[],"awayRadioBroadcasters":[],"awayOttBroadcasters":[]},"homeTeam":{"teamId":1611661317,"teamName":"Mercury","teamCity":"Phoenix","teamTricode":"PHX","teamSlug":"mercury","wins":0,"losses":0,"score":0,"seed":0},"awayTeam":{"teamId":1611661324,"teamName":"Lynx","teamCity":"Minnesota","teamTricode":"MIN","teamSlug":"lynx","wins":0,"losses":0,"score":0,"seed":0},"pointsLeaders":[]}]},{"gameDate":"05/13/2026 00:00:00","games":[{"gameId":"1022600016","gameCode":"20260513/LVACON","gameStatus":1,"gameStatusText":"8:00 pm ET","gameSequence":2,"gameDateEst":"2026-05-13T00:00:00Z","gameTimeEst":"1900-01-01T20:00:00Z","gameDateTimeEst":"2026-05-13T20:00:00Z","gameDateUTC":"2026-05-13T04:00:00Z","gameTimeUTC":"1900-01-01T00:00:00Z","gameDateTimeUTC":"2026-05-14T00:00:00Z","awayTeamTime":"2026-05-13T17:00:00Z","homeTeamTime":"2026-05-13T20:00:00Z","day":"Wed","monthNum":5,"weekNumber":0,"weekName":"","ifNecessary":false,"seriesGameNumber":"","gameLabel":"","gameSubLabel":"","seriesText":"","arenaName":"Mohegan Sun Arena","arenaState":"CT","arenaCity":"Uncasville","postponedStatus":"N","branchLink":"","gameSubtype":"","isNeutral":false,"broadcasters":{"nationalBroadcasters":[],"nationalRadioBroadcasters":[],"nationalOttBroadcasters":[],"homeTvBroadcasters":[],"homeRadioBroadcasters":[],"homeOttBroadcasters":[],"awayTvBroadcasters":[],"awayRadioBroadcasters":[],"awayOttBroadcasters":[]},"homeTeam":{"teamId":1611661323,"teamName":"Sun","teamCity":"Connecticut","teamTricode":"CON","teamSlug":"sun","wins":0,"losses":0,"score":0,"seed":0},"awayTeam":{"teamId":1611661319,"teamName":"Aces","teamCity":"Las Vegas","teamTricode":"LVA","teamSlug":"aces","wins":0,"losses":0,"score":0,"seed":0},"pointsLeaders":[]},{"gameId":"1022600017","gameCode":"20260513/CHIGSV","gameStatus":1,"gameStatusText":"10:00 pm ET","gameSequence":3,"gameDateEst":"2026-05-13T00:00:00Z","gameTimeEst":"1900-01-01T22:00:00Z","gameDateTimeEst":"2026-05-13T22:00:00Z","gameDateUTC":"2026-05-13T04:00:00Z","gameTimeUTC":"1900-01-01T02:00:00Z","gameDateTimeUTC":"2026-05-14T02:00:00Z","awayTeamTime":"2026-05-13T21:00:00Z","homeTeamTime":"2026-05-13T19:00:00Z","day":"Wed","monthNum":5,"weekNumber":0,"weekName":"","ifNecessary":false,"seriesGameNumber":"","gameLabel":"","gameSubLabel":"","seriesText":"","arenaName":"Chase Center","arenaState":"CA","arenaCity":"San Francisco","postponedStatus":"N","branchLink":"","gameSubtype":"","isNeutral":false,"broadcasters":{"nationalBroadcasters":[],"nationalRadioBroadcasters":[],"nationalOttBroadcasters":[],"homeTvBroadcasters":[],"homeRadioBroadcasters":[],"homeOttBroadcasters":[],"awayTvBroadcasters":[],"awayRadioBroadcasters":[],"awayOttBroadcasters":[]},"homeTeam":{"teamId":1611661331,"teamName":"Valkyries","teamCity":"Golden State","teamTricode":"GSV","teamSlug":"valkyries","wins":0,"losses":0,"score":0,"seed":0},"awayTeam":{"teamId":1611661329,"teamName":"Sky","teamCity":"Chicago","teamTricode":"CHI","teamSlug":"sky","wins":0,"losses":0,"score":0,"seed":0},"pointsLeaders":[]},{"gameId":"1022600018","gameCode":"20260513/INDLAS","gameStatus":1,"gameStatusText":"10:00 pm ET","gameSequence":4,"gameDateEst":"2026-05-13T00:00:00Z","gameTimeEst":"1900-01-01T22:00:00Z","gameDateTimeEst":"2026-05-13T22:00:00Z","gameDateUTC":"2026-05-13T04:00:00Z","gameTimeUTC":"1900-01-01T02:00:00Z","gameDateTimeUTC":"2026-05-14T02:00:00Z","awayTeamTime":"2026-05-13T22:00:00Z","homeTeamTime":"2026-05-13T19:00:00Z","day":"Wed","monthNum":5,"weekNumber":0,"weekName":"","ifNecessary":false,"seriesGameNumber":"","gameLabel":"","gameSubLabel":"","seriesText":"","arenaName":"Crypto.com Arena","arenaState":"CA","arenaCity":"Los Angeles","postponedStatus":"N","branchLink":"","gameSubtype":"","isNeutral":false,"broadcasters":{"nationalBroadcasters":[],"nationalRadioBroadcasters":[],"nationalOttBroadcasters":[],"homeTvBroadcasters":[],"homeRadioBroadcasters":[],"homeOttBroadcasters":[],"awayTvBroadcasters":[],"awayRadioBroadcasters":[],"awayOttBroadcasters":[]},"homeTeam":{"teamId":1611661320,"teamName":"Sparks","teamCity":"Los Angeles","teamTricode":"LAS","teamSlug":"sparks","wins":0,"losses":0,"score":0,"seed":0},"awayTeam":{"teamId":1611661325,"teamName":"Fever","teamCity":"Indiana","teamTricode":"IND","teamSlug":"fever","wins":0,"losses":0,"score":0,"seed":0},"pointsLeaders":[]}]},{"gameDate":"05/14/2026 00:00:00","games":[{"gameId":"1022600019","gameCode":"20260514/MINDAL","gameStatus":1,"gameStatusText":"8:00 pm ET","gameSequence":1,"gameDateEst":"2026-05-14T00:00:00Z","gameTimeEst":"1900-01-01T20:00:00Z","gameDateTimeEst":"2026-05-14T20:00:00Z","gameDateUTC":"2026-05-14T04:00:00Z","gameTimeUTC":"1900-01-01T00:00:00Z","gameDateTimeUTC":"2026-05-15T00:00:00Z","awayTeamTime":"2026-05-14T19:00:00Z","homeTeamTime":"2026-05-14T19:00:00Z","day":"Thu","monthNum":5,"weekNumber":0,"weekName":"","ifNecessary":false,"seriesGameNumber":"","gameLabel":"","gameSubLabel":"","seriesText":"","arenaName":"College Park Center","arenaState":"TX","arenaCity":"Arlington","postponedStatus":"N","branchLink":"","gameSubtype":"","isNeutral":false,"broadcasters":{"nationalBroadcasters":[],"nationalRadioBroadcasters":[],"nationalOttBroadcasters":[],"homeTvBroadcasters":[],"homeRadioBroadcasters":[],"homeOttBroadcasters":[],"awayTvBroadcasters":[],"awayRadioBroadcasters":[],"awayOttBroadcasters":[]},"homeTeam":{"teamId":1611661321,"teamName":"Wings","teamCity":"Dallas","teamTricode":"DAL","teamSlug":"wings","wins":0,"losses":0,"score":0,"seed":0},"awayTeam":{"teamId":1611661324,"teamName":"Lynx","teamCity":"Minnesota","teamTricode":"MIN","teamSlug":"lynx","wins":0,"losses":0,"score":0,"seed":0},"pointsLeaders":[]}]},{"gameDate":"05/15/2026 00:00:00","games":[{"gameId":"1022600021","gameCode":"20260515/LVACON","gameStatus":1,"gameStatusText":"7:30 pm ET","gameSequence":1,"gameDateEst":"2026-05-15T00:00:00Z","gameTimeEst":"1900-01-01T19:30:00Z","gameDateTimeEst":"2026-05-15T19:30:00Z","gameDateUTC":"2026-05-15T04:00:00Z","gameTimeUTC":"1900-01-01T23:30:00Z","gameDateTimeUTC":"2026-05-15T23:30:00Z","awayTeamTime":"2026-05-15T16:30:00Z","homeTeamTime":"2026-05-15T19:30:00Z","day":"Fri","monthNum":5,"weekNumber":0,"weekName":"","ifNecessary":false,"seriesGameNumber":"","gameLabel":"","gameSubLabel":"","seriesText":"","arenaName":"Mohegan Sun Arena","arenaState":"CT","arenaCity":"Uncasville","postponedStatus":"N","branchLink":"","gameSubtype":"","isNeutral":false,"broadcasters":{"nationalBroadcasters":[],"nationalRadioBroadcasters":[],"nationalOttBroadcasters":[],"homeTvBroadcasters":[],"homeRadioBroadcasters":[],"homeOttBroadcasters":[],"awayTvBroadcasters":[],"awayRadioBroadcasters":[],"awayOttBroadcasters":[]},"homeTeam":{"teamId":1611661323,"teamName":"Sun","teamCity":"Connecticut","teamTricode":"CON","teamSlug":"sun","wins":0,"losses":0,"score":0,"seed":0},"awayTeam":{"teamId":1611661319,"teamName":"Aces","teamCity":"Las Vegas","teamTricode":"LVA","teamSlug":"aces","wins":0,"losses":0,"score":0,"seed":0},"pointsLeaders":[]},{"gameId":"1022600022","gameCode":"20260515/WASIND","gameStatus":1,"gameStatusText":"7:30 pm ET","gameSequence":2,"gameDateEst":"2026-05-15T00:00:00Z","gameTimeEst":"1900-01-01T19:30:00Z","gameDateTimeEst":"2026-05-15T19:30:00Z","gameDateUTC":"2026-05-15T04:00:00Z","gameTimeUTC":"1900-01-01T23:30:00Z","gameDateTimeUTC":"2026-05-15T23:30:00Z","awayTeamTime":"2026-05-15T19:30:00Z","homeTeamTime":"2026-05-15T19:30:00Z","day":"Fri","monthNum":5,"weekNumber":0,"weekName":"","ifNecessary":false,"seriesGameNumber":"","gameLabel":"","gameSubLabel":"","seriesText":"","arenaName":"Gainbridge Fieldhouse","arenaState":"IN","arenaCity":"Indianapolis","postponedStatus":"N","branchLink":"","gameSubtype":"","isNeutral":false,"broadcasters":{"nationalBroadcasters":[],"nationalRadioBroadcasters":[],"nationalOttBroadcasters":[],"homeTvBroadcasters":[],"homeRadioBroadcasters":[],"homeOttBroadcasters":[],"awayTvBroadcasters":[],"awayRadioBroadcasters":[],"awayOttBroadcasters":[]},"homeTeam":{"teamId":1611661325,"teamName":"Fever","teamCity":"Indiana","teamTricode":"IND","teamSlug":"fever","wins":0,"losses":0,"score":0,"seed":0},"awayTeam":{"teamId":1611661322,"teamName":"Mystics","teamCity":"Washington","teamTricode":"WAS","teamSlug":"mystics","wins":0,"losses":0,"score":0,"seed":0},"pointsLeaders":[]},{"gameId":"1022600024","gameCode":"20260515/CHIPHX","gameStatus":1,"gameStatusText":"10:00 pm ET","gameSequence":4,"gameDateEst":"2026-05-15T00:00:00Z","gameTimeEst":"1900-01-01T22:00:00Z","gameDateTimeEst":"2026-05-15T22:00:00Z","gameDateUTC":"2026-05-15T04:00:00Z","gameTimeUTC":"1900-01-01T02:00:00Z","gameDateTimeUTC":"2026-05-16T02:00:00Z","awayTeamTime":"2026-05-15T21:00:00Z","homeTeamTime":"2026-05-15T19:00:00Z","day":"Fri","monthNum":5,"weekNumber":0,"weekName":"","ifNecessary":false,"seriesGameNumber":"","gameLabel":"","gameSubLabel":"","seriesText":"","arenaName":"Mortgage Matchup Center","arenaState":"AZ","arenaCity":"Phoenix","postponedStatus":"N","branchLink":"","gameSubtype":"","isNeutral":false,"broadcasters":{"nationalBroadcasters":[],"nationalRadioBroadcasters":[],"nationalOttBroadcasters":[],"homeTvBroadcasters":[],"homeRadioBroadcasters":[],"homeOttBroadcasters":[],"awayTvBroadcasters":[],"awayRadioBroadcasters":[],"awayOttBroadcasters":[]},"homeTeam":{"teamId":1611661317,"teamName":"Mercury","teamCity":"Phoenix","teamTricode":"PHX","teamSlug":"mercury","wins":0,"losses":0,"score":0,"seed":0},"awayTeam":{"teamId":1611661329,"teamName":"Sky","teamCity":"Chicago","teamTricode":"CHI","teamSlug":"sky","wins":0,"losses":0,"score":0,"seed":0},"pointsLeaders":[]}]},{"gameDate":"05/17/2026 00:00:00","games":[{"gameId":"1022600025","gameCode":"20260517/CHIMIN","gameStatus":1,"gameStatusText":"1:30 pm ET","gameSequence":1,"gameDateEst":"2026-05-17T00:00:00Z","gameTimeEst":"1900-01-01T13:30:00Z","gameDateTimeEst":"2026-05-17T13:30:00Z","gameDateUTC":"2026-05-17T04:00:00Z","gameTimeUTC":"1900-01-01T17:30:00Z","gameDateTimeUTC":"2026-05-17T17:30:00Z","awayTeamTime":"2026-05-17T12:30:00Z","homeTeamTime":"2026-05-17T12:30:00Z","day":"Sun","monthNum":5,"weekNumber":0,"weekName":"","ifNecessary":false,"seriesGameNumber":"","gameLabel":"","gameSubLabel":"","seriesText":"","arenaName":"Target Center","arenaState":"MN","arenaCity":"Minneapolis","postponedStatus":"N","branchLink":"","gameSubtype":"","isNeutral":false,"broadcasters":{"nationalBroadcasters":[],"nationalRadioBroadcasters":[],"nationalOttBroadcasters":[],"homeTvBroadcasters":[],"homeRadioBroadcasters":[],"homeOttBroadcasters":[],"awayTvBroadcasters":[],"awayRadioBroadcasters":[],"awayOttBroadcasters":[]},"homeTeam":{"teamId":1611661324,"teamName":"Lynx","teamCity":"Minnesota","teamTricode":"MIN","teamSlug":"lynx","wins":0,"losses":0,"score":0,"seed":0},"awayTeam":{"teamId":1611661329,"teamName":"Sky","teamCity":"Chicago","teamTricode":"CHI","teamSlug":"sky","wins":0,"losses":0,"score":0,"seed":0},"pointsLeaders":[]},{"gameId":"1022600026","gameCode":"20260517/LVAATL","gameStatus":1,"gameStatusText":"3:00 pm ET","gameSequence":2,"gameDateEst":"2026-05-17T00:00:00Z","gameTimeEst":"1900-01-01T15:00:00Z","gameDateTimeEst":"2026-05-17T15:00:00Z","gameDateUTC":"2026-05-17T04:00:00Z","gameTimeUTC":"1900-01-01T19:00:00Z","gameDateTimeUTC":"2026-05-17T19:00:00Z","awayTeamTime":"2026-05-17T12:00:00Z","homeTeamTime":"2026-05-17T15:00:00Z","day":"Sun","monthNum":5,"weekNumber":0,"weekName":"","ifNecessary":false,"seriesGameNumber":"","gameLabel":"","gameSubLabel":"","seriesText":"","arenaName":"Gateway Center Arena @ College Park","arenaState":"GA","arenaCity":"Atlanta","postponedStatus":"N","branchLink":"","gameSubtype":"","isNeutral":false,"broadcasters":{"nationalBroadcasters":[],"nationalRadioBroadcasters":[],"nationalOttBroadcasters":[],"homeTvBroadcasters":[],"homeRadioBroadcasters":[],"homeOttBroadcasters":[],"awayTvBroadcasters":[],"awayRadioBroadcasters":[],"awayOttBroadcasters":[]},"homeTeam":{"teamId":1611661330,"teamName":"Dream","teamCity":"Atlanta","teamTricode":"ATL","teamSlug":"dream","wins":0,"losses":0,"score":0,"seed":0},"awayTeam":{"teamId":1611661319,"teamName":"Aces","teamCity":"Las Vegas","teamTricode":"LVA","teamSlug":"aces","wins":0,"losses":0,"score":0,"seed":0},"pointsLeaders":[]},{"gameId":"1022600027","gameCode":"20260517/SEAIND","gameStatus":1,"gameStatusText":"6:00 pm ET","gameSequence":3,"gameDateEst":"2026-05-17T00:00:00Z","gameTimeEst":"1900-01-01T18:00:00Z","gameDateTimeEst":"2026-05-17T18:00:00Z","gameDateUTC":"2026-05-17T04:00:00Z","gameTimeUTC":"1900-01-01T22:00:00Z","gameDateTimeUTC":"2026-05-17T22:00:00Z","awayTeamTime":"2026-05-17T15:00:00Z","homeTeamTime":"2026-05-17T18:00:00Z","day":"Sun","monthNum":5,"weekNumber":0,"weekName":"","ifNecessary":false,"seriesGameNumber":"","gameLabel":"","gameSubLabel":"","seriesText":"","arenaName":"Gainbridge Fieldhouse","arenaState":"IN","arenaCity":"Indianapolis","postponedStatus":"N","branchLink":"","gameSubtype":"","isNeutral":false,"broadcasters":{"nationalBroadcasters":[],"nationalRadioBroadcasters":[],"nationalOttBroadcasters":[],"homeTvBroadcasters":[],"homeRadioBroadcasters":[],"homeOttBroadcasters":[],"awayTvBroadcasters":[],"awayRadioBroadcasters":[],"awayOttBroadcasters":[]},"homeTeam":{"teamId":1611661325,"teamName":"Fever","teamCity":"Indiana","teamTricode":"IND","teamSlug":"fever","wins":0,"losses":0,"score":0,"seed":0},"awayTeam":{"teamId":1611661328,"teamName":"Storm","teamCity":"Seattle","teamTricode":"SEA","teamSlug":"storm","wins":0,"losses":0,"score":0,"seed":0},"pointsLeaders":[]}]},{"gameDate":"05/18/2026 00:00:00","games":[{"gameId":"1022600029","gameCode":"20260518/WASDAL","gameStatus":1,"gameStatusText":"8:00 pm ET","gameSequence":1,"gameDateEst":"2026-05-18T00:00:00Z","gameTimeEst":"1900-01-01T20:00:00Z","gameDateTimeEst":"2026-05-18T20:00:00Z","gameDateUTC":"2026-05-18T04:00:00Z","gameTimeUTC":"1900-01-01T00:00:00Z","gameDateTimeUTC":"2026-05-19T00:00:00Z","awayTeamTime":"2026-05-18T20:00:00Z","homeTeamTime":"2026-05-18T19:00:00Z","day":"Mon","monthNum":5,"weekNumber":0,"weekName":"","ifNecessary":false,"seriesGameNumber":"","gameLabel":"","gameSubLabel":"","seriesText":"","arenaName":"College Park Center","arenaState":"TX","arenaCity":"Arlington","postponedStatus":"N","branchLink":"","gameSubtype":"","isNeutral":false,"broadcasters":{"nationalBroadcasters":[],"nationalRadioBroadcasters":[],"nationalOttBroadcasters":[],"homeTvBroadcasters":[],"homeRadioBroadcasters":[],"homeOttBroadcasters":[],"awayTvBroadcasters":[],"awayRadioBroadcasters":[],"awayOttBroadcasters":[]},"homeTeam":{"teamId":1611661321,"teamName":"Wings","teamCity":"Dallas","teamTricode":"DAL","teamSlug":"wings","wins":0,"losses":0,"score":0,"seed":0},"awayTeam":{"teamId":1611661322,"teamName":"Mystics","teamCity":"Washington","teamTricode":"WAS","teamSlug":"mystics","wins":0,"losses":0,"score":0,"seed":0},"pointsLeaders":[]}]},{"gameDate":"05/19/2026 00:00:00","games":[]},{"gameDate":"05/20/2026 00:00:00","games":[{"gameId":"1022600033","gameCode":"20260520/DALCHI","gameStatus":1,"gameStatusText":"9:00 pm ET","gameSequence":2,"gameDateEst":"2026-05-20T00:00:00Z","gameTimeEst":"1900-01-01T21:00:00Z","gameDateTimeEst":"2026-05-20T21:00:00Z","gameDateUTC":"2026-05-20T04:00:00Z","gameTimeUTC":"1900-01-01T01:00:00Z","gameDateTimeUTC":"2026-05-21T01:00:00Z","awayTeamTime":"2026-05-20T20:00:00Z","homeTeamTime":"2026-05-20T20:00:00Z","day":"Wed","monthNum":5,"weekNumber":0,"weekName":"","ifNecessary":false,"seriesGameNumber":"","gameLabel":"","gameSubLabel":"","seriesText":"","arenaName":"Wintrust Arena","arenaState":"IL","arenaCity":"Chicago","postponedStatus":"N","branchLink":"","gameSubtype":"","isNeutral":false,"broadcasters":{"nationalBroadcasters":[],"nationalRadioBroadcasters":[],"nationalOttBroadcasters":[],"homeTvBroadcasters":[],"homeRadioBroadcasters":[],"homeOttBroadcasters":[],"awayTvBroadcasters":[],"awayRadioBroadcasters":[],"awayOttBroadcasters":[]},"homeTeam":{"teamId":1611661329,"teamName":"Sky","teamCity":"Chicago","teamTricode":"CHI","teamSlug":"sky","wins":0,"losses":0,"score":0,"seed":0},"awayTeam":{"teamId":1611661321,"teamName":"Wings","teamCity":"Dallas","teamTricode":"DAL","teamSlug":"wings","wins":0,"losses":0,"score":0,"seed":0},"pointsLeaders":[]},{"gameId":"1022600034","gameCode":"20260520/CONSEA","gameStatus":1,"gameStatusText":"10:00 pm ET","gameSequence":3,"gameDateEst":"2026-05-20T00:00:00Z","gameTimeEst":"1900-01-01T22:00:00Z","gameDateTimeEst":"2026-05-20T22:00:00Z","gameDateUTC":"2026-05-20T04:00:00Z","gameTimeUTC":"1900-01-01T02:00:00Z","gameDateTimeUTC":"2026-05-21T02:00:00Z","awayTeamTime":"2026-05-20T22:00:00Z","homeTeamTime":"2026-05-20T19:00:00Z","day":"Wed","monthNum":5,"weekNumber":0,"weekName":"","ifNecessary":false,"seriesGameNumber":"","gameLabel":"","gameSubLabel":"","seriesText":"","arenaName":"Climate Pledge Arena","arenaState":"WA","arenaCity":"Seattle","postponedStatus":"N","branchLink":"","gameSubtype":"","isNeutral":false,"broadcasters":{"nationalBroadcasters":[],"nationalRadioBroadcasters":[],"nationalOttBroadcasters":[],"homeTvBroadcasters":[],"homeRadioBroadcasters":[],"homeOttBroadcasters":[],"awayTvBroadcasters":[],"awayRadioBroadcasters":[],"awayOttBroadcasters":[]},"homeTeam":{"teamId":1611661328,"teamName":"Storm","teamCity":"Seattle","teamTricode":"SEA","teamSlug":"storm","wins":0,"losses":0,"score":0,"seed":0},"awayTeam":{"teamId":1611661323,"teamName":"Sun","teamCity":"Connecticut","teamTricode":"CON","teamSlug":"sun","wins":0,"losses":0,"score":0,"seed":0},"pointsLeaders":[]}]},{"gameDate":"05/21/2026 00:00:00","games":[{"gameId":"1022600035","gameCode":"20260521/GSVNYL","gameStatus":1,"gameStatusText":"8:00 pm ET","gameSequence":1,"gameDateEst":"2026-05-21T00:00:00Z","gameTimeEst":"1900-01-01T20:00:00Z","gameDateTimeEst":"2026-05-21T20:00:00Z","gameDateUTC":"2026-05-21T04:00:00Z","gameTimeUTC":"1900-01-01T00:00:00Z","gameDateTimeUTC":"2026-05-22T00:00:00Z","awayTeamTime":"2026-05-21T17:00:00Z","homeTeamTime":"2026-05-21T20:00:00Z","day":"Thu","monthNum":5,"weekNumber":0,"weekName":"","ifNecessary":false,"seriesGameNumber":"","gameLabel":"","gameSubLabel":"","seriesText":"","arenaName":"Barclays Center","arenaState":"NY","arenaCity":"Brooklyn","postponedStatus":"N","branchLink":"","gameSubtype":"","isNeutral":false,"broadcasters":{"nationalBroadcasters":[],"nationalRadioBroadcasters":[],"nationalOttBroadcasters":[],"homeTvBroadcasters":[],"homeRadioBroadcasters":[],"homeOttBroadcasters":[],"awayTvBroadcasters":[],"awayRadioBroadcasters":[],"awayOttBroadcasters":[]},"homeTeam":{"teamId":1611661313,"teamName":"Liberty","teamCity":"New York","teamTricode":"NYL","teamSlug":"liberty","wins":0,"losses":0,"score":0,"seed":0},"awayTeam":{"teamId":1611661331,"teamName":"Valkyries","teamCity":"Golden State","teamTricode":"GSV","teamSlug":"valkyries","wins":0,"losses":0,"score":0,"seed":0},"pointsLeaders":[]},{"gameId":"1022600037","gameCode":"20260521/LASPHX","gameStatus":1,"gameStatusText":"10:00 pm ET","gameSequence":3,"gameDateEst":"2026-05-21T00:00:00Z","gameTimeEst":"1900-01-01T22:00:00Z","gameDateTimeEst":"2026-05-21T22:00:00Z","gameDateUTC":"2026-05-21T04:00:00Z","gameTimeUTC":"1900-01-01T02:00:00Z","gameDateTimeUTC":"2026-05-22T02:00:00Z","awayTeamTime":"2026-05-21T19:00:00Z","homeTeamTime":"2026-05-21T19:00:00Z","day":"Thu","monthNum":5,"weekNumber":0,"weekName":"","ifNecessary":false,"seriesGameNumber":"","gameLabel":"","gameSubLabel":"","seriesText":"","arenaName":"Mortgage Matchup Center","arenaState":"AZ","arenaCity":"Phoenix","postponedStatus":"N","branchLink":"","gameSubtype":"","isNeutral":false,"broadcasters":{"nationalBroadcasters":[],"nationalRadioBroadcasters":[],"nationalOttBroadcasters":[],"homeTvBroadcasters":[],"homeRadioBroadcasters":[],"homeOttBroadcasters":[],"awayTvBroadcasters":[],"awayRadioBroadcasters":[],"awayOttBroadcasters":[]},"homeTeam":{"teamId":1611661317,"teamName":"Mercury","teamCity":"Phoenix","teamTricode":"PHX","teamSlug":"mercury","wins":0,"losses":0,"score":0,"seed":0},"awayTeam":{"teamId":1611661320,"teamName":"Sparks","teamCity":"Los Angeles","teamTricode":"LAS","teamSlug":"sparks","wins":0,"losses":0,"score":0,"seed":0},"pointsLeaders":[]}]},{"gameDate":"05/22/2026 00:00:00","games":[{"gameId":"1022600038","gameCode":"20260522/DALATL","gameStatus":1,"gameStatusText":"7:30 pm ET","gameSequence":1,"gameDateEst":"2026-05-22T00:00:00Z","gameTimeEst":"1900-01-01T19:30:00Z","gameDateTimeEst":"2026-05-22T19:30:00Z","gameDateUTC":"2026-05-22T04:00:00Z","gameTimeUTC":"1900-01-01T23:30:00Z","gameDateTimeUTC":"2026-05-22T23:30:00Z","awayTeamTime":"2026-05-22T18:30:00Z","homeTeamTime":"2026-05-22T19:30:00Z","day":"Fri","monthNum":5,"weekNumber":0,"weekName":"","ifNecessary":false,"seriesGameNumber":"","gameLabel":"","gameSubLabel":"","seriesText":"","arenaName":"Gateway Center Arena @ College Park","arenaState":"GA","arenaCity":"Atlanta","postponedStatus":"N","branchLink":"","gameSubtype":"","isNeutral":false,"broadcasters":{"nationalBroadcasters":[],"nationalRadioBroadcasters":[],"nationalOttBroadcasters":[],"homeTvBroadcasters":[],"homeRadioBroadcasters":[],"homeOttBroadcasters":[],"awayTvBroadcasters":[],"awayRadioBroadcasters":[],"awayOttBroadcasters":[]},"homeTeam":{"teamId":1611661330,"teamName":"Dream","teamCity":"Atlanta","teamTricode":"ATL","teamSlug":"dream","wins":0,"losses":0,"score":0,"seed":0},"awayTeam":{"teamId":1611661321,"teamName":"Wings","teamCity":"Dallas","teamTricode":"DAL","teamSlug":"wings","wins":0,"losses":0,"score":0,"seed":0},"pointsLeaders":[]},{"gameId":"1022600039","gameCode":"20260522/GSVIND","gameStatus":1,"gameStatusText":"7:30 pm ET","gameSequence":2,"gameDateEst":"2026-05-22T00:00:00Z","gameTimeEst":"1900-01-01T19:30:00Z","gameDateTimeEst":"2026-05-22T19:30:00Z","gameDateUTC":"2026-05-22T04:00:00Z","gameTimeUTC":"1900-01-01T23:30:00Z","gameDateTimeUTC":"2026-05-22T23:30:00Z","awayTeamTime":"2026-05-22T16:30:00Z","homeTeamTime":"2026-05-22T19:30:00Z","day":"Fri","monthNum":5,"weekNumber":0,"weekName":"","ifNecessary":false,"seriesGameNumber":"","gameLabel":"","gameSubLabel":"","seriesText":"","arenaName":"Gainbridge Fieldhouse","arenaState":"IN","arenaCity":"Indianapolis","postponedStatus":"N","branchLink":"","gameSubtype":"","isNeutral":false,"broadcasters":{"nationalBroadcasters":[],"nationalRadioBroadcasters":[],"nationalOttBroadcasters":[],"homeTvBroadcasters":[],"homeRadioBroadcasters":[],"homeOttBroadcasters":[],"awayTvBroadcasters":[],"awayRadioBroadcasters":[],"awayOttBroadcasters":[]},"homeTeam":{"teamId":1611661325,"teamName":"Fever","teamCity":"Indiana","teamTricode":"IND","teamSlug":"fever","wins":0,"losses":0,"score":0,"seed":0},"awayTeam":{"teamId":1611661331,"teamName":"Valkyries","teamCity":"Golden State","teamTricode":"GSV","teamSlug":"valkyries","wins":0,"losses":0,"score":0,"seed":0},"pointsLeaders":[]},{"gameId":"1022600040","gameCode":"20260522/CONSEA","gameStatus":1,"gameStatusText":"10:00 pm ET","gameSequence":3,"gameDateEst":"2026-05-22T00:00:00Z","gameTimeEst":"1900-01-01T22:00:00Z","gameDateTimeEst":"2026-05-22T22:00:00Z","gameDateUTC":"2026-05-22T04:00:00Z","gameTimeUTC":"1900-01-01T02:00:00Z","gameDateTimeUTC":"2026-05-23T02:00:00Z","awayTeamTime":"2026-05-22T22:00:00Z","homeTeamTime":"2026-05-22T19:00:00Z","day":"Fri","monthNum":5,"weekNumber":0,"weekName":"","ifNecessary":false,"seriesGameNumber":"","gameLabel":"","gameSubLabel":"","seriesText":"","arenaName":"Climate Pledge Arena","arenaState":"WA","arenaCity":"Seattle","postponedStatus":"N","branchLink":"","gameSubtype":"","isNeutral":false,"broadcasters":{"nationalBroadcasters":[],"nationalRadioBroadcasters":[],"nationalOttBroadcasters":[],"homeTvBroadcasters":[],"homeRadioBroadcasters":[],"homeOttBroadcasters":[],"awayTvBroadcasters":[],"awayRadioBroadcasters":[],"awayOttBroadcasters":[]},"homeTeam":{"teamId":1611661328,"teamName":"Storm","teamCity":"Seattle","teamTricode":"SEA","teamSlug":"storm","wins":0,"losses":0,"score":0,"seed":0},"awayTeam":{"teamId":1611661323,"teamName":"Sun","teamCity":"Connecticut","teamTricode":"CON","teamSlug":"sun","wins":0,"losses":0,"score":0,"seed":0},"pointsLeaders":[]}]},{"gameDate":"05/23/2026 00:00:00","games":[{"gameId":"1022600041","gameCode":"20260523/MINCHI","gameStatus":1,"gameStatusText":"1:00 pm ET","gameSequence":1,"gameDateEst":"2026-05-23T00:00:00Z","gameTimeEst":"1900-01-01T13:00:00Z","gameDateTimeEst":"2026-05-23T13:00:00Z","gameDateUTC":"2026-05-23T04:00:00Z","gameTimeUTC":"1900-01-01T17:00:00Z","gameDateTimeUTC":"2026-05-23T17:00:00Z","awayTeamTime":"2026-05-23T12:00:00Z","homeTeamTime":"2026-05-23T12:00:00Z","day":"Sat","monthNum":5,"weekNumber":0,"weekName":"","ifNecessary":false,"seriesGameNumber":"","gameLabel":"","gameSubLabel":"","seriesText":"","arenaName":"Wintrust Arena","arenaState":"IL","arenaCity":"Chicago","postponedStatus":"N","branchLink":"","gameSubtype":"","isNeutral":false,"broadcasters":{"nationalBroadcasters":[],"nationalRadioBroadcasters":[],"nationalOttBroadcasters":[],"homeTvBroadcasters":[],"homeRadioBroadcasters":[],"homeOttBroadcasters":[],"awayTvBroadcasters":[],"awayRadioBroadcasters":[],"awayOttBroadcasters":[]},"homeTeam":{"teamId":1611661329,"teamName":"Sky","teamCity":"Chicago","teamTricode":"CHI","teamSlug":"sky","wins":0,"losses":0,"score":0,"seed":0},"awayTeam":{"teamId":1611661324,"teamName":"Lynx","teamCity":"Minnesota","teamTricode":"MIN","teamSlug":"lynx","wins":0,"losses":0,"score":0,"seed":0},"pointsLeaders":[]},{"gameId":"1022600043","gameCode":"20260523/LASLVA","gameStatus":1,"gameStatusText":"8:00 pm ET","gameSequence":3,"gameDateEst":"2026-05-23T00:00:00Z","gameTimeEst":"1900-01-01T20:00:00Z","gameDateTimeEst":"2026-05-23T20:00:00Z","gameDateUTC":"2026-05-23T04:00:00Z","gameTimeUTC":"1900-01-01T00:00:00Z","gameDateTimeUTC":"2026-05-24T00:00:00Z","awayTeamTime":"2026-05-23T17:00:00Z","homeTeamTime":"2026-05-23T17:00:00Z","day":"Sat","monthNum":5,"weekNumber":0,"weekName":"","ifNecessary":false,"seriesGameNumber":"","gameLabel":"","gameSubLabel":"","seriesText":"","arenaName":"Michelob ULTRA Arena","arenaState":"NV","arenaCity":"Las Vegas","postponedStatus":"N","branchLink":"","gameSubtype":"","isNeutral":false,"broadcasters":{"nationalBroadcasters":[],"nationalRadioBroadcasters":[],"nationalOttBroadcasters":[],"homeTvBroadcasters":[],"homeRadioBroadcasters":[],"homeOttBroadcasters":[],"awayTvBroadcasters":[],"awayRadioBroadcasters":[],"awayOttBroadcasters":[]},"homeTeam":{"teamId":1611661319,"teamName":"Aces","teamCity":"Las Vegas","teamTricode":"LVA","teamSlug":"aces","wins":0,"losses":0,"score":0,"seed":0},"awayTeam":{"teamId":1611661320,"teamName":"Sparks","teamCity":"Los Angeles","teamTricode":"LAS","teamSlug":"sparks","wins":0,"losses":0,"score":0,"seed":0},"pointsLeaders":[]}]},{"gameDate":"05/24/2026 00:00:00","games":[{"gameId":"1022600044","gameCode":"20260524/PHXATL","gameStatus":1,"gameStatusText":"3:00 pm ET","gameSequence":1,"gameDateEst":"2026-05-24T00:00:00Z","gameTimeEst":"1900-01-01T15:00:00Z","gameDateTimeEst":"2026-05-24T15:00:00Z","gameDateUTC":"2026-05-24T04:00:00Z","gameTimeUTC":"1900-01-01T19:00:00Z","gameDateTimeUTC":"2026-05-24T19:00:00Z","awayTeamTime":"2026-05-24T12:00:00Z","homeTeamTime":"2026-05-24T15:00:00Z","day":"Sun","monthNum":5,"weekNumber":0,"weekName":"","ifNecessary":false,"seriesGameNumber":"","gameLabel":"","gameSubLabel":"","seriesText":"","arenaName":"Gateway Center Arena @ College Park","arenaState":"GA","arenaCity":"Atlanta","postponedStatus":"N","branchLink":"","gameSubtype":"","isNeutral":false,"broadcasters":{"nationalBroadcasters":[],"nationalRadioBroadcasters":[],"nationalOttBroadcasters":[],"homeTvBroadcasters":[],"homeRadioBroadcasters":[],"homeOttBroadcasters":[],"awayTvBroadcasters":[],"awayRadioBroadcasters":[],"awayOttBroadcasters":[]},"homeTeam":{"teamId":1611661330,"teamName":"Dream","teamCity":"Atlanta","teamTricode":"ATL","teamSlug":"dream","wins":0,"losses":0,"score":0,"seed":0},"awayTeam":{"teamId":1611661317,"teamName":"Mercury","teamCity":"Phoenix","teamTricode":"PHX","teamSlug":"mercury","wins":0,"losses":0,"score":0,"seed":0},"pointsLeaders":[]},{"gameId":"1022600045","gameCode":"20260524/DALNYL","gameStatus":1,"gameStatusText":"3:30 pm ET","gameSequence":2,"gameDateEst":"2026-05-24T00:00:00Z","gameTimeEst":"1900-01-01T15:30:00Z","gameDateTimeEst":"2026-05-24T15:30:00Z","gameDateUTC":"2026-05-24T04:00:00Z","gameTimeUTC":"1900-01-01T19:30:00Z","gameDateTimeUTC":"2026-05-24T19:30:00Z","awayTeamTime":"2026-05-24T14:30:00Z","homeTeamTime":"2026-05-24T15:30:00Z","day":"Sun","monthNum":5,"weekNumber":0,"weekName":"","ifNecessary":false,"seriesGameNumber":"","gameLabel":"","gameSubLabel":"","seriesText":"","arenaName":"Barclays Center","arenaState":"NY","arenaCity":"Brooklyn","postponedStatus":"N","branchLink":"","gameSubtype":"","isNeutral":false,"broadcasters":{"nationalBroadcasters":[],"nationalRadioBroadcasters":[],"nationalOttBroadcasters":[],"homeTvBroadcasters":[],"homeRadioBroadcasters":[],"homeOttBroadcasters":[],"awayTvBroadcasters":[],"awayRadioBroadcasters":[],"awayOttBroadcasters":[]},"homeTeam":{"teamId":1611661313,"teamName":"Liberty","teamCity":"New York","teamTricode":"NYL","teamSlug":"liberty","wins":0,"losses":0,"score":0,"seed":0},"awayTeam":{"teamId":1611661321,"teamName":"Wings","teamCity":"Dallas","teamTricode":"DAL","teamSlug":"wings","wins":0,"losses":0,"score":0,"seed":0},"pointsLeaders":[]},{"gameId":"1022600046","gameCode":"20260524/WASSEA","gameStatus":1,"gameStatusText":"6:00 pm ET","gameSequence":3,"gameDateEst":"2026-05-24T00:00:00Z","gameTimeEst":"1900-01-01T18:00:00Z","gameDateTimeEst":"2026-05-24T18:00:00Z","gameDateUTC":"2026-05-24T04:00:00Z","gameTimeUTC":"1900-01-01T22:00:00Z","gameDateTimeUTC":"2026-05-24T22:00:00Z","awayTeamTime":"2026-05-24T18:00:00Z","homeTeamTime":"2026-05-24T15:00:00Z","day":"Sun","monthNum":5,"weekNumber":0,"weekName":"","ifNecessary":false,"seriesGameNumber":"","gameLabel":"","gameSubLabel":"","seriesText":"","arenaName":"Climate Pledge Arena","arenaState":"WA","arenaCity":"Seattle","postponedStatus":"N","branchLink":"","gameSubtype":"","isNeutral":false,"broadcasters":{"nationalBroadcasters":[],"nationalRadioBroadcasters":[],"nationalOttBroadcasters":[],"homeTvBroadcasters":[],"homeRadioBroadcasters":[],"homeOttBroadcasters":[],"awayTvBroadcasters":[],"awayRadioBroadcasters":[],"awayOttBroadcasters":[]},"homeTeam":{"teamId":1611661328,"teamName":"Storm","teamCity":"Seattle","teamTricode":"SEA","teamSlug":"storm","wins":0,"losses":0,"score":0,"seed":0},"awayTeam":{"teamId":1611661322,"teamName":"Mystics","teamCity":"Washington","teamTricode":"WAS","teamSlug":"mystics","wins":0,"losses":0,"score":0,"seed":0},"pointsLeaders":[]}]},{"gameDate":"05/25/2026 00:00:00","games":[{"gameId":"1022600048","gameCode":"20260525/CONGSV","gameStatus":1,"gameStatusText":"10:00 pm ET","gameSequence":2,"gameDateEst":"2026-05-25T00:00:00Z","gameTimeEst":"1900-01-01T22:00:00Z","gameDateTimeEst":"2026-05-25T22:00:00Z","gameDateUTC":"2026-05-25T04:00:00Z","gameTimeUTC":"1900-01-01T02:00:00Z","gameDateTimeUTC":"2026-05-26T02:00:00Z","awayTeamTime":"2026-05-25T22:00:00Z","homeTeamTime":"2026-05-25T19:00:00Z","day":"Mon","monthNum":5,"weekNumber":0,"weekName":"","ifNecessary":false,"seriesGameNumber":"","gameLabel":"","gameSubLabel":"","seriesText":"","arenaName":"Chase Center","arenaState":"CA","arenaCity":"San Francisco","postponedStatus":"N","branchLink":"","gameSubtype":"","isNeutral":false,"broadcasters":{"nationalBroadcasters":[],"nationalRadioBroadcasters":[],"nationalOttBroadcasters":[],"homeTvBroadcasters":[],"homeRadioBroadcasters":[],"homeOttBroadcasters":[],"awayTvBroadcasters":[],"awayRadioBroadcasters":[],"awayOttBroadcasters":[]},"homeTeam":{"teamId":1611661331,"teamName":"Valkyries","teamCity":"Golden State","teamTricode":"GSV","teamSlug":"valkyries","wins":0,"losses":0,"score":0,"seed":0},"awayTeam":{"teamId":1611661323,"teamName":"Sun","teamCity":"Connecticut","teamTricode":"CON","teamSlug":"sun","wins":0,"losses":0,"score":0,"seed":0},"pointsLeaders":[]}]},{"gameDate":"05/27/2026 00:00:00","games":[{"gameId":"1022600049","gameCode":"20260527/PHXNYL","gameStatus":1,"gameStatusText":"7:00 pm ET","gameSequence":1,"gameDateEst":"2026-05-27T00:00:00Z","gameTimeEst":"1900-01-01T19:00:00Z","gameDateTimeEst":"2026-05-27T19:00:00Z","gameDateUTC":"2026-05-27T04:00:00Z","gameTimeUTC":"1900-01-01T23:00:00Z","gameDateTimeUTC":"2026-05-27T23:00:00Z","awayTeamTime":"2026-05-27T16:00:00Z","homeTeamTime":"2026-05-27T19:00:00Z","day":"Wed","monthNum":5,"weekNumber":0,"weekName":"","ifNecessary":false,"seriesGameNumber":"","gameLabel":"","gameSubLabel":"","seriesText":"","arenaName":"Barclays Center","arenaState":"NY","arenaCity":"Brooklyn","postponedStatus":"N","branchLink":"","gameSubtype":"","isNeutral":false,"broadcasters":{"nationalBroadcasters":[],"nationalRadioBroadcasters":[],"nationalOttBroadcasters":[],"homeTvBroadcasters":[],"homeRadioBroadcasters":[],"homeOttBroadcasters":[],"awayTvBroadcasters":[],"awayRadioBroadcasters":[],"awayOttBroadcasters":[]},"homeTeam":{"teamId":1611661313,"teamName":"Liberty","teamCity":"New York","teamTricode":"NYL","teamSlug":"liberty","wins":0,"losses":0,"score":0,"seed":0},"awayTeam":{"teamId":1611661317,"teamName":"Mercury","teamCity":"Phoenix","teamTricode":"PHX","teamSlug":"mercury","wins":0,"losses":0,"score":0,"seed":0},"pointsLeaders":[]},{"gameId":"1022600051","gameCode":"20260527/ATLMIN","gameStatus":1,"gameStatusText":"9:00 pm ET","gameSequence":3,"gameDateEst":"2026-05-27T00:00:00Z","gameTimeEst":"1900-01-01T21:00:00Z","gameDateTimeEst":"2026-05-27T21:00:00Z","gameDateUTC":"2026-05-27T04:00:00Z","gameTimeUTC":"1900-01-01T01:00:00Z","gameDateTimeUTC":"2026-05-28T01:00:00Z","awayTeamTime":"2026-05-27T21:00:00Z","homeTeamTime":"2026-05-27T20:00:00Z","day":"Wed","monthNum":5,"weekNumber":0,"weekName":"","ifNecessary":false,"seriesGameNumber":"","gameLabel":"","gameSubLabel":"","seriesText":"","arenaName":"Target Center","arenaState":"MN","arenaCity":"Minneapolis","postponedStatus":"N","branchLink":"","gameSubtype":"","isNeutral":false,"broadcasters":{"nationalBroadcasters":[],"nationalRadioBroadcasters":[],"nationalOttBroadcasters":[],"homeTvBroadcasters":[],"homeRadioBroadcasters":[],"homeOttBroadcasters":[],"awayTvBroadcasters":[],"awayRadioBroadcasters":[],"awayOttBroadcasters":[]},"homeTeam":{"teamId":1611661324,"teamName":"Lynx","teamCity":"Minnesota","teamTricode":"MIN","teamSlug":"lynx","wins":0,"losses":0,"score":0,"seed":0},"awayTeam":{"teamId":1611661330,"teamName":"Dream","teamCity":"Atlanta","teamTricode":"ATL","teamSlug":"dream","wins":0,"losses":0,"score":0,"seed":0},"pointsLeaders":[]},{"gameId":"1022600053","gameCode":"20260527/WASSEA","gameStatus":1,"gameStatusText":"10:00 pm ET","gameSequence":5,"gameDateEst":"2026-05-27T00:00:00Z","gameTimeEst":"1900-01-01T22:00:00Z","gameDateTimeEst":"2026-05-27T22:00:00Z","gameDateUTC":"2026-05-27T04:00:00Z","gameTimeUTC":"1900-01-01T02:00:00Z","gameDateTimeUTC":"2026-05-28T02:00:00Z","awayTeamTime":"2026-05-27T22:00:00Z","homeTeamTime":"2026-05-27T19:00:00Z","day":"Wed","monthNum":5,"weekNumber":0,"weekName":"","ifNecessary":false,"seriesGameNumber":"","gameLabel":"","gameSubLabel":"","seriesText":"","arenaName":"Climate Pledge Arena","arenaState":"WA","arenaCity":"Seattle","postponedStatus":"N","branchLink":"","gameSubtype":"","isNeutral":false,"broadcasters":{"nationalBroadcasters":[],"nationalRadioBroadcasters":[],"nationalOttBroadcasters":[],"homeTvBroadcasters":[],"homeRadioBroadcasters":[],"homeOttBroadcasters":[],"awayTvBroadcasters":[],"awayRadioBroadcasters":[],"awayOttBroadcasters":[]},"homeTeam":{"teamId":1611661328,"teamName":"Storm","teamCity":"Seattle","teamTricode":"SEA","teamSlug":"storm","wins":0,"losses":0,"score":0,"seed":0},"awayTeam":{"teamId":1611661322,"teamName":"Mystics","teamCity":"Washington","teamTricode":"WAS","teamSlug":"mystics","wins":0,"losses":0,"score":0,"seed":0},"pointsLeaders":[]}]},{"gameDate":"05/28/2026 00:00:00","games":[{"gameId":"1022600054","gameCode":"20260528/LVADAL","gameStatus":1,"gameStatusText":"8:00 pm ET","gameSequence":1,"gameDateEst":"2026-05-28T00:00:00Z","gameTimeEst":"1900-01-01T20:00:00Z","gameDateTimeEst":"2026-05-28T20:00:00Z","gameDateUTC":"2026-05-28T04:00:00Z","gameTimeUTC":"1900-01-01T00:00:00Z","gameDateTimeUTC":"2026-05-29T00:00:00Z","awayTeamTime":"2026-05-28T17:00:00Z","homeTeamTime":"2026-05-28T19:00:00Z","day":"Thu","monthNum":5,"weekNumber":0,"weekName":"","ifNecessary":false,"seriesGameNumber":"","gameLabel":"","gameSubLabel":"","seriesText":"","arenaName":"College Park Center","arenaState":"TX","arenaCity":"Arlington","postponedStatus":"N","branchLink":"","gameSubtype":"","isNeutral":false,"broadcasters":{"nationalBroadcasters":[],"nationalRadioBroadcasters":[],"nationalOttBroadcasters":[],"homeTvBroadcasters":[],"homeRadioBroadcasters":[],"homeOttBroadcasters":[],"awayTvBroadcasters":[],"awayRadioBroadcasters":[],"awayOttBroadcasters":[]},"homeTeam":{"teamId":1611661321,"teamName":"Wings","teamCity":"Dallas","teamTricode":"DAL","teamSlug":"wings","wins":0,"losses":0,"score":0,"seed":0},"awayTeam":{"teamId":1611661319,"teamName":"Aces","teamCity":"Las Vegas","teamTricode":"LVA","teamSlug":"aces","wins":0,"losses":0,"score":0,"seed":0},"pointsLeaders":[]},{"gameId":"1022600055","gameCode":"20260528/INDGSV","gameStatus":1,"gameStatusText":"10:00 pm ET","gameSequence":2,"gameDateEst":"2026-05-28T00:00:00Z","gameTimeEst":"1900-01-01T22:00:00Z","gameDateTimeEst":"2026-05-28T22:00:00Z","gameDateUTC":"2026-05-28T04:00:00Z","gameTimeUTC":"1900-01-01T02:00:00Z","gameDateTimeUTC":"2026-05-29T02:00:00Z","awayTeamTime":"2026-05-28T22:00:00Z","homeTeamTime":"2026-05-28T19:00:00Z","day":"Thu","monthNum":5,"weekNumber":0,"weekName":"","ifNecessary":false,"seriesGameNumber":"","gameLabel":"","gameSubLabel":"","seriesText":"","arenaName":"Chase Center","arenaState":"CA","arenaCity":"San Francisco","postponedStatus":"N","branchLink":"","gameSubtype":"","isNeutral":false,"broadcasters":{"nationalBroadcasters":[],"nationalRadioBroadcasters":[],"nationalOttBroadcasters":[],"homeTvBroadcasters":[],"homeRadioBroadcasters":[],"homeOttBroadcasters":[],"awayTvBroadcasters":[],"awayRadioBroadcasters":[],"awayOttBroadcasters":[]},"homeTeam":{"teamId":1611661331,"teamName":"Valkyries","teamCity":"Golden State","teamTricode":"GSV","teamSlug":"valkyries","wins":0,"losses":0,"score":0,"seed":0},"awayTeam":{"teamId":1611661325,"teamName":"Fever","teamCity":"Indiana","teamTricode":"IND","teamSlug":"fever","wins":0,"losses":0,"score":0,"seed":0},"pointsLeaders":[]}]},{"gameDate":"05/29/2026 00:00:00","games":[{"gameId":"1022600056","gameCode":"20260529/PHXNYL","gameStatus":1,"gameStatusText":"7:30 pm ET","gameSequence":1,"gameDateEst":"2026-05-29T00:00:00Z","gameTimeEst":"1900-01-01T19:30:00Z","gameDateTimeEst":"2026-05-29T19:30:00Z","gameDateUTC":"2026-05-29T04:00:00Z","gameTimeUTC":"1900-01-01T23:30:00Z","gameDateTimeUTC":"2026-05-29T23:30:00Z","awayTeamTime":"2026-05-29T16:30:00Z","homeTeamTime":"2026-05-29T19:30:00Z","day":"Fri","monthNum":5,"weekNumber":0,"weekName":"","ifNecessary":false,"seriesGameNumber":"","gameLabel":"","gameSubLabel":"","seriesText":"","arenaName":"Barclays Center","arenaState":"NY","arenaCity":"Brooklyn","postponedStatus":"N","branchLink":"","gameSubtype":"","isNeutral":false,"broadcasters":{"nationalBroadcasters":[],"nationalRadioBroadcasters":[],"nationalOttBroadcasters":[],"homeTvBroadcasters":[],"homeRadioBroadcasters":[],"homeOttBroadcasters":[],"awayTvBroadcasters":[],"awayRadioBroadcasters":[],"awayOttBroadcasters":[]},"homeTeam":{"teamId":1611661313,"teamName":"Liberty","teamCity":"New York","teamTricode":"NYL","teamSlug":"liberty","wins":0,"losses":0,"score":0,"seed":0},"awayTeam":{"teamId":1611661317,"teamName":"Mercury","teamCity":"Phoenix","teamTricode":"PHX","teamSlug":"mercury","wins":0,"losses":0,"score":0,"seed":0},"pointsLeaders":[]},{"gameId":"1022600057","gameCode":"20260529/LASWAS","gameStatus":1,"gameStatusText":"7:30 pm ET","gameSequence":2,"gameDateEst":"2026-05-29T00:00:00Z","gameTimeEst":"1900-01-01T19:30:00Z","gameDateTimeEst":"2026-05-29T19:30:00Z","gameDateUTC":"2026-05-29T04:00:00Z","gameTimeUTC":"1900-01-01T23:30:00Z","gameDateTimeUTC":"2026-05-29T23:30:00Z","awayTeamTime":"2026-05-29T16:30:00Z","homeTeamTime":"2026-05-29T19:30:00Z","day":"Fri","monthNum":5,"weekNumber":0,"weekName":"","ifNecessary":false,"seriesGameNumber":"","gameLabel":"","gameSubLabel":"","seriesText":"","arenaName":"CareFirst Arena","arenaState":"DC","arenaCity":"Washington","postponedStatus":"N","branchLink":"","gameSubtype":"","isNeutral":false,"broadcasters":{"nationalBroadcasters":[],"nationalRadioBroadcasters":[],"nationalOttBroadcasters":[],"homeTvBroadcasters":[],"homeRadioBroadcasters":[],"homeOttBroadcasters":[],"awayTvBroadcasters":[],"awayRadioBroadcasters":[],"awayOttBroadcasters":[]},"homeTeam":{"teamId":1611661322,"teamName":"Mystics","teamCity":"Washington","teamTricode":"WAS","teamSlug":"mystics","wins":0,"losses":0,"score":0,"seed":0},"awayTeam":{"teamId":1611661320,"teamName":"Sparks","teamCity":"Los Angeles","teamTricode":"LAS","teamSlug":"sparks","wins":0,"losses":0,"score":0,"seed":0},"pointsLeaders":[]},{"gameId":"1022600058","gameCode":"20260529/MINCHI","gameStatus":1,"gameStatusText":"7:30 pm ET","gameSequence":3,"gameDateEst":"2026-05-29T00:00:00Z","gameTimeEst":"1900-01-01T19:30:00Z","gameDateTimeEst":"2026-05-29T19:30:00Z","gameDateUTC":"2026-05-29T04:00:00Z","gameTimeUTC":"1900-01-01T23:30:00Z","gameDateTimeUTC":"2026-05-29T23:30:00Z","awayTeamTime":"2026-05-29T18:30:00Z","homeTeamTime":"2026-05-29T18:30:00Z","day":"Fri","monthNum":5,"weekNumber":0,"weekName":"","ifNecessary":false,"seriesGameNumber":"","gameLabel":"","gameSubLabel":"","seriesText":"","arenaName":"Wintrust Arena","arenaState":"IL","arenaCity":"Chicago","postponedStatus":"N","branchLink":"","gameSubtype":"","isNeutral":false,"broadcasters":{"nationalBroadcasters":[],"nationalRadioBroadcasters":[],"nationalOttBroadcasters":[],"homeTvBroadcasters":[],"homeRadioBroadcasters":[],"homeOttBroadcasters":[],"awayTvBroadcasters":[],"awayRadioBroadcasters":[],"awayOttBroadcasters":[]},"homeTeam":{"teamId":1611661329,"teamName":"Sky","teamCity":"Chicago","teamTricode":"CHI","teamSlug":"sky","wins":0,"losses":0,"score":0,"seed":0},"awayTeam":{"teamId":1611661324,"teamName":"Lynx","teamCity":"Minnesota","teamTricode":"MIN","teamSlug":"lynx","wins":0,"losses":0,"score":0,"seed":0},"pointsLeaders":[]}]},{"gameDate":"05/30/2026 00:00:00","games":[{"gameId":"1022600061","gameCode":"20260530/LASCON","gameStatus":1,"gameStatusText":"6:00 pm ET","gameSequence":2,"gameDateEst":"2026-05-30T00:00:00Z","gameTimeEst":"1900-01-01T18:00:00Z","gameDateTimeEst":"2026-05-30T18:00:00Z","gameDateUTC":"2026-05-30T04:00:00Z","gameTimeUTC":"1900-01-01T22:00:00Z","gameDateTimeUTC":"2026-05-30T22:00:00Z","awayTeamTime":"2026-05-30T15:00:00Z","homeTeamTime":"2026-05-30T18:00:00Z","day":"Sat","monthNum":5,"weekNumber":0,"weekName":"","ifNecessary":false,"seriesGameNumber":"","gameLabel":"","gameSubLabel":"","seriesText":"","arenaName":"PeoplesBank Arena","arenaState":"CT","arenaCity":"Hartford","postponedStatus":"N","branchLink":"","gameSubtype":"","isNeutral":false,"broadcasters":{"nationalBroadcasters":[],"nationalRadioBroadcasters":[],"nationalOttBroadcasters":[],"homeTvBroadcasters":[],"homeRadioBroadcasters":[],"homeOttBroadcasters":[],"awayTvBroadcasters":[],"awayRadioBroadcasters":[],"awayOttBroadcasters":[]},"homeTeam":{"teamId":1611661323,"teamName":"Sun","teamCity":"Connecticut","teamTricode":"CON","teamSlug":"sun","wins":0,"losses":0,"score":0,"seed":0},"awayTeam":{"teamId":1611661320,"teamName":"Sparks","teamCity":"Los Angeles","teamTricode":"LAS","teamSlug":"sparks","wins":0,"losses":0,"score":0,"seed":0},"pointsLeaders":[]}]},{"gameDate":"05/31/2026 00:00:00","games":[{"gameId":"1022600063","gameCode":"20260531/LVAGSV","gameStatus":1,"gameStatusText":"3:30 pm ET","gameSequence":1,"gameDateEst":"2026-05-31T00:00:00Z","gameTimeEst":"1900-01-01T15:30:00Z","gameDateTimeEst":"2026-05-31T15:30:00Z","gameDateUTC":"2026-05-31T04:00:00Z","gameTimeUTC":"1900-01-01T19:30:00Z","gameDateTimeUTC":"2026-05-31T19:30:00Z","awayTeamTime":"2026-05-31T12:30:00Z","homeTeamTime":"2026-05-31T12:30:00Z","day":"Sun","monthNum":5,"weekNumber":0,"weekName":"","ifNecessary":false,"seriesGameNumber":"","gameLabel":"","gameSubLabel":"","seriesText":"","arenaName":"Chase Center","arenaState":"CA","arenaCity":"San Francisco","postponedStatus":"N","branchLink":"","gameSubtype":"","isNeutral":false,"broadcasters":{"nationalBroadcasters":[],"nationalRadioBroadcasters":[],"nationalOttBroadcasters":[],"homeTvBroadcasters":[],"homeRadioBroadcasters":[],"homeOttBroadcasters":[],"awayTvBroadcasters":[],"awayRadioBroadcasters":[],"awayOttBroadcasters":[]},"homeTeam":{"teamId":1611661331,"teamName":"Valkyries","teamCity":"Golden State","teamTricode":"GSV","teamSlug":"valkyries","wins":0,"losses":0,"score":0,"seed":0},"awayTeam":{"teamId":1611661319,"teamName":"Aces","teamCity":"Las Vegas","teamTricode":"LVA","teamSlug":"aces","wins":0,"losses":0,"score":0,"seed":0},"pointsLeaders":[]}]},{"gameDate":"06/01/2026 00:00:00","games":[{"gameId":"1022600064","gameCode":"20260601/SEADAL","gameStatus":1,"gameStatusText":"8:00 pm ET","gameSequence":1,"gameDateEst":"2026-06-01T00:00:00Z","gameTimeEst":"1900-01-01T20:00:00Z","gameDateTimeEst":"2026-06-01T20:00:00Z","gameDateUTC":"2026-06-01T04:00:00Z","gameTimeUTC":"1900-01-01T00:00:00Z","gameDateTimeUTC":"2026-06-02T00:00:00Z","awayTeamTime":"2026-06-01T17:00:00Z","homeTeamTime":"2026-06-01T19:00:00Z","day":"Mon","monthNum":6,"weekNumber":0,"weekName":"","ifNecessary":false,"seriesGameNumber":"","gameLabel":"Commissioner's Cup","gameSubLabel":"","seriesText":"","arenaName":"College Park Center","arenaState":"TX","arenaCity":"Arlington","postponedStatus":"N","branchLink":"","gameSubtype":"Commissioner","isNeutral":false,"broadcasters":{"nationalBroadcasters":[],"nationalRadioBroadcasters":[],"nationalOttBroadcasters":[],"homeTvBroadcasters":[],"homeRadioBroadcasters":[],"homeOttBroadcasters":[],"awayTvBroadcasters":[],"awayRadioBroadcasters":[],"awayOttBroadcasters":[]},"homeTeam":{"teamId":1611661321,"teamName":"Wings","teamCity":"Dallas","teamTricode":"DAL","teamSlug":"wings","wins":0,"losses":0,"score":0,"seed":0},"awayTeam":{"teamId":1611661328,"teamName":"Storm","teamCity":"Seattle","teamTricode":"SEA","teamSlug":"storm","wins":0,"losses":0,"score":0,"seed":0},"pointsLeaders":[]},{"gameId":"1022600065","gameCode":"20260601/MINPHX","gameStatus":1,"gameStatusText":"10:00 pm ET","gameSequence":2,"gameDateEst":"2026-06-01T00:00:00Z","gameTimeEst":"1900-01-01T22:00:00Z","gameDateTimeEst":"2026-06-01T22:00:00Z","gameDateUTC":"2026-06-01T04:00:00Z","gameTimeUTC":"1900-01-01T02:00:00Z","gameDateTimeUTC":"2026-06-02T02:00:00Z","awayTeamTime":"2026-06-01T21:00:00Z","homeTeamTime":"2026-06-01T19:00:00Z","day":"Mon","monthNum":6,"weekNumber":0,"weekName":"","ifNecessary":false,"seriesGameNumber":"","gameLabel":"Commissioner's Cup","gameSubLabel":"","seriesText":"","arenaName":"Mortgage Matchup Center","arenaState":"AZ","arenaCity":"Phoenix","postponedStatus":"N","branchLink":"","gameSubtype":"Commissioner","isNeutral":false,"broadcasters":{"nationalBroadcasters":[],"nationalRadioBroadcasters":[],"nationalOttBroadcasters":[],"homeTvBroadcasters":[],"homeRadioBroadcasters":[],"homeOttBroadcasters":[],"awayTvBroadcasters":[],"awayRadioBroadcasters":[],"awayOttBroadcasters":[]},"homeTeam":{"teamId":1611661317,"teamName":"Mercury","teamCity":"Phoenix","teamTricode":"PHX","teamSlug":"mercury","wins":0,"losses":0,"score":0,"seed":0},"awayTeam":{"teamId":1611661324,"teamName":"Lynx","teamCity":"Minnesota","teamTricode":"MIN","teamSlug":"lynx","wins":0,"losses":0,"score":0,"seed":0},"pointsLeaders":[]}]},{"gameDate":"06/02/2026 00:00:00","games":[{"gameId":"1022600066","gameCode":"20260602/CONATL","gameStatus":1,"gameStatusText":"7:30 pm ET","gameSequence":1,"gameDateEst":"2026-06-02T00:00:00Z","gameTimeEst":"1900-01-01T19:30:00Z","gameDateTimeEst":"2026-06-02T19:30:00Z","gameDateUTC":"2026-06-02T04:00:00Z","gameTimeUTC":"1900-01-01T23:30:00Z","gameDateTimeUTC":"2026-06-02T23:30:00Z","awayTeamTime":"2026-06-02T19:30:00Z","homeTeamTime":"2026-06-02T19:30:00Z","day":"Tue","monthNum":6,"weekNumber":0,"weekName":"","ifNecessary":false,"seriesGameNumber":"","gameLabel":"Commissioner's Cup","gameSubLabel":"","seriesText":"","arenaName":"Gateway Center Arena @ College Park","arenaState":"GA","arenaCity":"Atlanta","postponedStatus":"N","branchLink":"","gameSubtype":"Commissioner","isNeutral":false,"broadcasters":{"nationalBroadcasters":[],"nationalRadioBroadcasters":[],"nationalOttBroadcasters":[],"homeTvBroadcasters":[],"homeRadioBroadcasters":[],"homeOttBroadcasters":[],"awayTvBroadcasters":[],"awayRadioBroadcasters":[],"awayOttBroadcasters":[]},"homeTeam":{"teamId":1611661330,"teamName":"Dream","teamCity":"Atlanta","teamTricode":"ATL","teamSlug":"dream","wins":0,"losses":0,"score":0,"seed":0},"awayTeam":{"teamId":1611661323,"teamName":"Sun","teamCity":"Connecticut","teamTricode":"CON","teamSlug":"sun","wins":0,"losses":0,"score":0,"seed":0},"pointsLeaders":[]},{"gameId":"1022600067","gameCode":"20260602/CHIWAS","gameStatus":1,"gameStatusText":"8:00 pm ET","gameSequence":2,"gameDateEst":"2026-06-02T00:00:00Z","gameTimeEst":"1900-01-01T20:00:00Z","gameDateTimeEst":"2026-06-02T20:00:00Z","gameDateUTC":"2026-06-02T04:00:00Z","gameTimeUTC":"1900-01-01T00:00:00Z","gameDateTimeUTC":"2026-06-03T00:00:00Z","awayTeamTime":"2026-06-02T19:00:00Z","homeTeamTime":"2026-06-02T20:00:00Z","day":"Tue","monthNum":6,"weekNumber":0,"weekName":"","ifNecessary":false,"seriesGameNumber":"","gameLabel":"Commissioner's Cup","gameSubLabel":"","seriesText":"","arenaName":"CareFirst Arena","arenaState":"DC","arenaCity":"Washington","postponedStatus":"N","branchLink":"","gameSubtype":"Commissioner","isNeutral":false,"broadcasters":{"nationalBroadcasters":[],"nationalRadioBroadcasters":[],"nationalOttBroadcasters":[],"homeTvBroadcasters":[],"homeRadioBroadcasters":[],"homeOttBroadcasters":[],"awayTvBroadcasters":[],"awayRadioBroadcasters":[],"awayOttBroadcasters":[]},"homeTeam":{"teamId":1611661322,"teamName":"Mystics","teamCity":"Washington","teamTricode":"WAS","teamSlug":"mystics","wins":0,"losses":0,"score":0,"seed":0},"awayTeam":{"teamId":1611661329,"teamName":"Sky","teamCity":"Chicago","teamTricode":"CHI","teamSlug":"sky","wins":0,"losses":0,"score":0,"seed":0},"pointsLeaders":[]},{"gameId":"1022600069","gameCode":"20260602/LVALAS","gameStatus":1,"gameStatusText":"10:00 pm ET","gameSequence":4,"gameDateEst":"2026-06-02T00:00:00Z","gameTimeEst":"1900-01-01T22:00:00Z","gameDateTimeEst":"2026-06-02T22:00:00Z","gameDateUTC":"2026-06-02T04:00:00Z","gameTimeUTC":"1900-01-01T02:00:00Z","gameDateTimeUTC":"2026-06-03T02:00:00Z","awayTeamTime":"2026-06-02T19:00:00Z","homeTeamTime":"2026-06-02T19:00:00Z","day":"Tue","monthNum":6,"weekNumber":0,"weekName":"","ifNecessary":false,"seriesGameNumber":"","gameLabel":"Commissioner's Cup","gameSubLabel":"","seriesText":"","arenaName":"Crypto.com Arena","arenaState":"CA","arenaCity":"Los Angeles","postponedStatus":"N","branchLink":"","gameSubtype":"Commissioner","isNeutral":false,"broadcasters":{"nationalBroadcasters":[],"nationalRadioBroadcasters":[],"nationalOttBroadcasters":[],"homeTvBroadcasters":[],"homeRadioBroadcasters":[],"homeOttBroadcasters":[],"awayTvBroadcasters":[],"awayRadioBroadcasters":[],"awayOttBroadcasters":[]},"homeTeam":{"teamId":1611661320,"teamName":"Sparks","teamCity":"Los Angeles","teamTricode":"LAS","teamSlug":"sparks","wins":0,"losses":0,"score":0,"seed":0},"awayTeam":{"teamId":1611661319,"teamName":"Aces","teamCity":"Las Vegas","teamTricode":"LVA","teamSlug":"aces","wins":0,"losses":0,"score":0,"seed":0},"pointsLeaders":[]}]},{"gameDate":"06/03/2026 00:00:00","games":[{"gameId":"1022600071","gameCode":"20260603/PHXSEA","gameStatus":1,"gameStatusText":"10:00 pm ET","gameSequence":2,"gameDateEst":"2026-06-03T00:00:00Z","gameTimeEst":"1900-01-01T22:00:00Z","gameDateTimeEst":"2026-06-03T22:00:00Z","gameDateUTC":"2026-06-03T04:00:00Z","gameTimeUTC":"1900-01-01T02:00:00Z","gameDateTimeUTC":"2026-06-04T02:00:00Z","awayTeamTime":"2026-06-03T19:00:00Z","homeTeamTime":"2026-06-03T19:00:00Z","day":"Wed","monthNum":6,"weekNumber":0,"weekName":"","ifNecessary":false,"seriesGameNumber":"","gameLabel":"Commissioner's Cup","gameSubLabel":"","seriesText":"","arenaName":"Climate Pledge Arena","arenaState":"WA","arenaCity":"Seattle","postponedStatus":"N","branchLink":"","gameSubtype":"Commissioner","isNeutral":false,"broadcasters":{"nationalBroadcasters":[],"nationalRadioBroadcasters":[],"nationalOttBroadcasters":[],"homeTvBroadcasters":[],"homeRadioBroadcasters":[],"homeOttBroadcasters":[],"awayTvBroadcasters":[],"awayRadioBroadcasters":[],"awayOttBroadcasters":[]},"homeTeam":{"teamId":1611661328,"teamName":"Storm","teamCity":"Seattle","teamTricode":"SEA","teamSlug":"storm","wins":0,"losses":0,"score":0,"seed":0},"awayTeam":{"teamId":1611661317,"teamName":"Mercury","teamCity":"Phoenix","teamTricode":"PHX","teamSlug":"mercury","wins":0,"losses":0,"score":0,"seed":0},"pointsLeaders":[]}]},{"gameDate":"06/04/2026 00:00:00","games":[{"gameId":"1022600072","gameCode":"20260604/ATLIND","gameStatus":1,"gameStatusText":"7:00 pm ET","gameSequence":1,"gameDateEst":"2026-06-04T00:00:00Z","gameTimeEst":"1900-01-01T19:00:00Z","gameDateTimeEst":"2026-06-04T19:00:00Z","gameDateUTC":"2026-06-04T04:00:00Z","gameTimeUTC":"1900-01-01T23:00:00Z","gameDateTimeUTC":"2026-06-04T23:00:00Z","awayTeamTime":"2026-06-04T19:00:00Z","homeTeamTime":"2026-06-04T19:00:00Z","day":"Thu","monthNum":6,"weekNumber":0,"weekName":"","ifNecessary":false,"seriesGameNumber":"","gameLabel":"Commissioner's Cup","gameSubLabel":"","seriesText":"","arenaName":"Gainbridge Fieldhouse","arenaState":"IN","arenaCity":"Indianapolis","postponedStatus":"N","branchLink":"","gameSubtype":"Commissioner","isNeutral":false,"broadcasters":{"nationalBroadcasters":[],"nationalRadioBroadcasters":[],"nationalOttBroadcasters":[],"homeTvBroadcasters":[],"homeRadioBroadcasters":[],"homeOttBroadcasters":[],"awayTvBroadcasters":[],"awayRadioBroadcasters":[],"awayOttBroadcasters":[]},"homeTeam":{"teamId":1611661325,"teamName":"Fever","teamCity":"Indiana","teamTricode":"IND","teamSlug":"fever","wins":0,"losses":0,"score":0,"seed":0},"awayTeam":{"teamId":1611661330,"teamName":"Dream","teamCity":"Atlanta","teamTricode":"ATL","teamSlug":"dream","wins":0,"losses":0,"score":0,"seed":0},"pointsLeaders":[]},{"gameId":"1022600073","gameCode":"20260604/GSVMIN","gameStatus":1,"gameStatusText":"9:00 pm ET","gameSequence":2,"gameDateEst":"2026-06-04T00:00:00Z","gameTimeEst":"1900-01-01T21:00:00Z","gameDateTimeEst":"2026-06-04T21:00:00Z","gameDateUTC":"2026-06-04T04:00:00Z","gameTimeUTC":"1900-01-01T01:00:00Z","gameDateTimeUTC":"2026-06-05T01:00:00Z","awayTeamTime":"2026-06-04T18:00:00Z","homeTeamTime":"2026-06-04T20:00:00Z","day":"Thu","monthNum":6,"weekNumber":0,"weekName":"","ifNecessary":false,"seriesGameNumber":"","gameLabel":"Commissioner's Cup","gameSubLabel":"","seriesText":"","arenaName":"Target Center","arenaState":"MN","arenaCity":"Minneapolis","postponedStatus":"N","branchLink":"","gameSubtype":"Commissioner","isNeutral":false,"broadcasters":{"nationalBroadcasters":[],"nationalRadioBroadcasters":[],"nationalOttBroadcasters":[],"homeTvBroadcasters":[],"homeRadioBroadcasters":[],"homeOttBroadcasters":[],"awayTvBroadcasters":[],"awayRadioBroadcasters":[],"awayOttBroadcasters":[]},"homeTeam":{"teamId":1611661324,"teamName":"Lynx","teamCity":"Minnesota","teamTricode":"MIN","teamSlug":"lynx","wins":0,"losses":0,"score":0,"seed":0},"awayTeam":{"teamId":1611661331,"teamName":"Valkyries","teamCity":"Golden State","teamTricode":"GSV","teamSlug":"valkyries","wins":0,"losses":0,"score":0,"seed":0},"pointsLeaders":[]}]},{"gameDate":"06/05/2026 00:00:00","games":[{"gameId":"1022600074","gameCode":"20260605/CONCHI","gameStatus":1,"gameStatusText":"7:30 pm ET","gameSequence":1,"gameDateEst":"2026-06-05T00:00:00Z","gameTimeEst":"1900-01-01T19:30:00Z","gameDateTimeEst":"2026-06-05T19:30:00Z","gameDateUTC":"2026-06-05T04:00:00Z","gameTimeUTC":"1900-01-01T23:30:00Z","gameDateTimeUTC":"2026-06-05T23:30:00Z","awayTeamTime":"2026-06-05T19:30:00Z","homeTeamTime":"2026-06-05T18:30:00Z","day":"Fri","monthNum":6,"weekNumber":0,"weekName":"","ifNecessary":false,"seriesGameNumber":"","gameLabel":"Commissioner's Cup","gameSubLabel":"","seriesText":"","arenaName":"Wintrust Arena","arenaState":"IL","arenaCity":"Chicago","postponedStatus":"N","branchLink":"","gameSubtype":"Commissioner","isNeutral":false,"broadcasters":{"nationalBroadcasters":[],"nationalRadioBroadcasters":[],"nationalOttBroadcasters":[],"homeTvBroadcasters":[],"homeRadioBroadcasters":[],"homeOttBroadcasters":[],"awayTvBroadcasters":[],"awayRadioBroadcasters":[],"awayOttBroadcasters":[]},"homeTeam":{"teamId":1611661329,"teamName":"Sky","teamCity":"Chicago","teamTricode":"CHI","teamSlug":"sky","wins":0,"losses":0,"score":0,"seed":0},"awayTeam":{"teamId":1611661323,"teamName":"Sun","teamCity":"Connecticut","teamTricode":"CON","teamSlug":"sun","wins":0,"losses":0,"score":0,"seed":0},"pointsLeaders":[]},{"gameId":"1022600075","gameCode":"20260605/DALLAS","gameStatus":1,"gameStatusText":"10:00 pm ET","gameSequence":2,"gameDateEst":"2026-06-05T00:00:00Z","gameTimeEst":"1900-01-01T22:00:00Z","gameDateTimeEst":"2026-06-05T22:00:00Z","gameDateUTC":"2026-06-05T04:00:00Z","gameTimeUTC":"1900-01-01T02:00:00Z","gameDateTimeUTC":"2026-06-06T02:00:00Z","awayTeamTime":"2026-06-05T21:00:00Z","homeTeamTime":"2026-06-05T19:00:00Z","day":"Fri","monthNum":6,"weekNumber":0,"weekName":"","ifNecessary":false,"seriesGameNumber":"","gameLabel":"Commissioner's Cup","gameSubLabel":"","seriesText":"","arenaName":"Crypto.com Arena","arenaState":"CA","arenaCity":"Los Angeles","postponedStatus":"N","branchLink":"","gameSubtype":"Commissioner","isNeutral":false,"broadcasters":{"nationalBroadcasters":[],"nationalRadioBroadcasters":[],"nationalOttBroadcasters":[],"homeTvBroadcasters":[],"homeRadioBroadcasters":[],"homeOttBroadcasters":[],"awayTvBroadcasters":[],"awayRadioBroadcasters":[],"awayOttBroadcasters":[]},"homeTeam":{"teamId":1611661320,"teamName":"Sparks","teamCity":"Los Angeles","teamTricode":"LAS","teamSlug":"sparks","wins":0,"losses":0,"score":0,"seed":0},"awayTeam":{"teamId":1611661321,"teamName":"Wings","teamCity":"Dallas","teamTricode":"DAL","teamSlug":"wings","wins":0,"losses":0,"score":0,"seed":0},"pointsLeaders":[]}]},{"gameDate":"06/06/2026 00:00:00","games":[{"gameId":"1022600077","gameCode":"20260606/SEAMIN","gameStatus":1,"gameStatusText":"1:00 pm ET","gameSequence":1,"gameDateEst":"2026-06-06T00:00:00Z","gameTimeEst":"1900-01-01T13:00:00Z","gameDateTimeEst":"2026-06-06T13:00:00Z","gameDateUTC":"2026-06-06T04:00:00Z","gameTimeUTC":"1900-01-01T17:00:00Z","gameDateTimeUTC":"2026-06-06T17:00:00Z","awayTeamTime":"2026-06-06T10:00:00Z","homeTeamTime":"2026-06-06T12:00:00Z","day":"Sat","monthNum":6,"weekNumber":0,"weekName":"","ifNecessary":false,"seriesGameNumber":"","gameLabel":"Commissioner's Cup","gameSubLabel":"","seriesText":"","arenaName":"Target Center","arenaState":"MN","arenaCity":"Minneapolis","postponedStatus":"N","branchLink":"","gameSubtype":"Commissioner","isNeutral":false,"broadcasters":{"nationalBroadcasters":[],"nationalRadioBroadcasters":[],"nationalOttBroadcasters":[],"homeTvBroadcasters":[],"homeRadioBroadcasters":[],"homeOttBroadcasters":[],"awayTvBroadcasters":[],"awayRadioBroadcasters":[],"awayOttBroadcasters":[]},"homeTeam":{"teamId":1611661324,"teamName":"Lynx","teamCity":"Minnesota","teamTricode":"MIN","teamSlug":"lynx","wins":0,"losses":0,"score":0,"seed":0},"awayTeam":{"teamId":1611661328,"teamName":"Storm","teamCity":"Seattle","teamTricode":"SEA","teamSlug":"storm","wins":0,"losses":0,"score":0,"seed":0},"pointsLeaders":[]},{"gameId":"1022600078","gameCode":"20260606/GSVLVA","gameStatus":1,"gameStatusText":"3:00 pm ET","gameSequence":2,"gameDateEst":"2026-06-06T00:00:00Z","gameTimeEst":"1900-01-01T15:00:00Z","gameDateTimeEst":"2026-06-06T15:00:00Z","gameDateUTC":"2026-06-06T04:00:00Z","gameTimeUTC":"1900-01-01T19:00:00Z","gameDateTimeUTC":"2026-06-06T19:00:00Z","awayTeamTime":"2026-06-06T12:00:00Z","homeTeamTime":"2026-06-06T12:00:00Z","day":"Sat","monthNum":6,"weekNumber":0,"weekName":"","ifNecessary":false,"seriesGameNumber":"","gameLabel":"Commissioner's Cup","gameSubLabel":"","seriesText":"","arenaName":"Michelob ULTRA Arena","arenaState":"NV","arenaCity":"Las Vegas","postponedStatus":"N","branchLink":"","gameSubtype":"Commissioner","isNeutral":false,"broadcasters":{"nationalBroadcasters":[],"nationalRadioBroadcasters":[],"nationalOttBroadcasters":[],"homeTvBroadcasters":[],"homeRadioBroadcasters":[],"homeOttBroadcasters":[],"awayTvBroadcasters":[],"awayRadioBroadcasters":[],"awayOttBroadcasters":[]},"homeTeam":{"teamId":1611661319,"teamName":"Aces","teamCity":"Las Vegas","teamTricode":"LVA","teamSlug":"aces","wins":0,"losses":0,"score":0,"seed":0},"awayTeam":{"teamId":1611661331,"teamName":"Valkyries","teamCity":"Golden State","teamTricode":"GSV","teamSlug":"valkyries","wins":0,"losses":0,"score":0,"seed":0},"pointsLeaders":[]},{"gameId":"1022600079","gameCode":"20260606/WASATL","gameStatus":1,"gameStatusText":"6:00 pm ET","gameSequence":3,"gameDateEst":"2026-06-06T00:00:00Z","gameTimeEst":"1900-01-01T18:00:00Z","gameDateTimeEst":"2026-06-06T18:00:00Z","gameDateUTC":"2026-06-06T04:00:00Z","gameTimeUTC":"1900-01-01T22:00:00Z","gameDateTimeUTC":"2026-06-06T22:00:00Z","awayTeamTime":"2026-06-06T18:00:00Z","homeTeamTime":"2026-06-06T18:00:00Z","day":"Sat","monthNum":6,"weekNumber":0,"weekName":"","ifNecessary":false,"seriesGameNumber":"","gameLabel":"Commissioner's Cup","gameSubLabel":"","seriesText":"","arenaName":"Gateway Center Arena @ College Park","arenaState":"GA","arenaCity":"Atlanta","postponedStatus":"N","branchLink":"","gameSubtype":"Commissioner","isNeutral":false,"broadcasters":{"nationalBroadcasters":[],"nationalRadioBroadcasters":[],"nationalOttBroadcasters":[],"homeTvBroadcasters":[],"homeRadioBroadcasters":[],"homeOttBroadcasters":[],"awayTvBroadcasters":[],"awayRadioBroadcasters":[],"awayOttBroadcasters":[]},"homeTeam":{"teamId":1611661330,"teamName":"Dream","teamCity":"Atlanta","teamTricode":"ATL","teamSlug":"dream","wins":0,"losses":0,"score":0,"seed":0},"awayTeam":{"teamId":1611661322,"teamName":"Mystics","teamCity":"Washington","teamTricode":"WAS","teamSlug":"mystics","wins":0,"losses":0,"score":0,"seed":0},"pointsLeaders":[]},{"gameId":"1022600080","gameCode":"20260606/INDNYL","gameStatus":1,"gameStatusText":"8:00 pm ET","gameSequence":4,"gameDateEst":"2026-06-06T00:00:00Z","gameTimeEst":"1900-01-01T20:00:00Z","gameDateTimeEst":"2026-06-06T20:00:00Z","gameDateUTC":"2026-06-06T04:00:00Z","gameTimeUTC":"1900-01-01T00:00:00Z","gameDateTimeUTC":"2026-06-07T00:00:00Z","awayTeamTime":"2026-06-06T20:00:00Z","homeTeamTime":"2026-06-06T20:00:00Z","day":"Sat","monthNum":6,"weekNumber":0,"weekName":"","ifNecessary":false,"seriesGameNumber":"","gameLabel":"Commissioner's Cup","gameSubLabel":"","seriesText":"","arenaName":"Barclays Center","arenaState":"NY","arenaCity":"Brooklyn","postponedStatus":"N","branchLink":"","gameSubtype":"Commissioner","isNeutral":false,"broadcasters":{"nationalBroadcasters":[],"nationalRadioBroadcasters":[],"nationalOttBroadcasters":[],"homeTvBroadcasters":[],"homeRadioBroadcasters":[],"homeOttBroadcasters":[],"awayTvBroadcasters":[],"awayRadioBroadcasters":[],"awayOttBroadcasters":[]},"homeTeam":{"teamId":1611661313,"teamName":"Liberty","teamCity":"New York","teamTricode":"NYL","teamSlug":"liberty","wins":0,"losses":0,"score":0,"seed":0},"awayTeam":{"teamId":1611661325,"teamName":"Fever","teamCity":"Indiana","teamTricode":"IND","teamSlug":"fever","wins":0,"losses":0,"score":0,"seed":0},"pointsLeaders":[]}]},{"gameDate":"06/07/2026 00:00:00","games":[]},{"gameDate":"06/08/2026 00:00:00","games":[{"gameId":"1022600083","gameCode":"20260608/NYLCON","gameStatus":1,"gameStatusText":"7:00 pm ET","gameSequence":1,"gameDateEst":"2026-06-08T00:00:00Z","gameTimeEst":"1900-01-01T19:00:00Z","gameDateTimeEst":"2026-06-08T19:00:00Z","gameDateUTC":"2026-06-08T04:00:00Z","gameTimeUTC":"1900-01-01T23:00:00Z","gameDateTimeUTC":"2026-06-08T23:00:00Z","awayTeamTime":"2026-06-08T19:00:00Z","homeTeamTime":"2026-06-08T19:00:00Z","day":"Mon","monthNum":6,"weekNumber":0,"weekName":"","ifNecessary":false,"seriesGameNumber":"","gameLabel":"Commissioner's Cup","gameSubLabel":"","seriesText":"","arenaName":"Mohegan Sun Arena","arenaState":"CT","arenaCity":"Uncasville","postponedStatus":"N","branchLink":"","gameSubtype":"Commissioner","isNeutral":false,"broadcasters":{"nationalBroadcasters":[],"nationalRadioBroadcasters":[],"nationalOttBroadcasters":[],"homeTvBroadcasters":[],"homeRadioBroadcasters":[],"homeOttBroadcasters":[],"awayTvBroadcasters":[],"awayRadioBroadcasters":[],"awayOttBroadcasters":[]},"homeTeam":{"teamId":1611661323,"teamName":"Sun","teamCity":"Connecticut","teamTricode":"CON","teamSlug":"sun","wins":0,"losses":0,"score":0,"seed":0},"awayTeam":{"teamId":1611661313,"teamName":"Liberty","teamCity":"New York","teamTricode":"NYL","teamSlug":"liberty","wins":0,"losses":0,"score":0,"seed":0},"pointsLeaders":[]},{"gameId":"1022600084","gameCode":"20260608/INDWAS","gameStatus":1,"gameStatusText":"8:00 pm ET","gameSequence":2,"gameDateEst":"2026-06-08T00:00:00Z","gameTimeEst":"1900-01-01T20:00:00Z","gameDateTimeEst":"2026-06-08T20:00:00Z","gameDateUTC":"2026-06-08T04:00:00Z","gameTimeUTC":"1900-01-01T00:00:00Z","gameDateTimeUTC":"2026-06-09T00:00:00Z","awayTeamTime":"2026-06-08T20:00:00Z","homeTeamTime":"2026-06-08T20:00:00Z","day":"Mon","monthNum":6,"weekNumber":0,"weekName":"","ifNecessary":false,"seriesGameNumber":"","gameLabel":"Commissioner's Cup","gameSubLabel":"","seriesText":"","arenaName":"CareFirst Arena","arenaState":"DC","arenaCity":"Washington","postponedStatus":"N","branchLink":"","gameSubtype":"Commissioner","isNeutral":false,"broadcasters":{"nationalBroadcasters":[],"nationalRadioBroadcasters":[],"nationalOttBroadcasters":[],"homeTvBroadcasters":[],"homeRadioBroadcasters":[],"homeOttBroadcasters":[],"awayTvBroadcasters":[],"awayRadioBroadcasters":[],"awayOttBroadcasters":[]},"homeTeam":{"teamId":1611661322,"teamName":"Mystics","teamCity":"Washington","teamTricode":"WAS","teamSlug":"mystics","wins":0,"losses":0,"score":0,"seed":0},"awayTeam":{"teamId":1611661325,"teamName":"Fever","teamCity":"Indiana","teamTricode":"IND","teamSlug":"fever","wins":0,"losses":0,"score":0,"seed":0},"pointsLeaders":[]},{"gameId":"1022600085","gameCode":"20260608/SEALVA","gameStatus":1,"gameStatusText":"10:00 pm ET","gameSequence":3,"gameDateEst":"2026-06-08T00:00:00Z","gameTimeEst":"1900-01-01T22:00:00Z","gameDateTimeEst":"2026-06-08T22:00:00Z","gameDateUTC":"2026-06-08T04:00:00Z","gameTimeUTC":"1900-01-01T02:00:00Z","gameDateTimeUTC":"2026-06-09T02:00:00Z","awayTeamTime":"2026-06-08T19:00:00Z","homeTeamTime":"2026-06-08T19:00:00Z","day":"Mon","monthNum":6,"weekNumber":0,"weekName":"","ifNecessary":false,"seriesGameNumber":"","gameLabel":"Commissioner's Cup","gameSubLabel":"","seriesText":"","arenaName":"Michelob ULTRA Arena","arenaState":"NV","arenaCity":"Las Vegas","postponedStatus":"N","branchLink":"","gameSubtype":"Commissioner","isNeutral":false,"broadcasters":{"nationalBroadcasters":[],"nationalRadioBroadcasters":[],"nationalOttBroadcasters":[],"homeTvBroadcasters":[],"homeRadioBroadcasters":[],"homeOttBroadcasters":[],"awayTvBroadcasters":[],"awayRadioBroadcasters":[],"awayOttBroadcasters":[]},"homeTeam":{"teamId":1611661319,"teamName":"Aces","teamCity":"Las Vegas","teamTricode":"LVA","teamSlug":"aces","wins":0,"losses":0,"score":0,"seed":0},"awayTeam":{"teamId":1611661328,"teamName":"Storm","teamCity":"Seattle","teamTricode":"SEA","teamSlug":"storm","wins":0,"losses":0,"score":0,"seed":0},"pointsLeaders":[]}]},{"gameDate":"06/09/2026 00:00:00","games":[{"gameId":"1022600086","gameCode":"20260609/ATLCHI","gameStatus":1,"gameStatusText":"8:00 pm ET","gameSequence":1,"gameDateEst":"2026-06-09T00:00:00Z","gameTimeEst":"1900-01-01T20:00:00Z","gameDateTimeEst":"2026-06-09T20:00:00Z","gameDateUTC":"2026-06-09T04:00:00Z","gameTimeUTC":"1900-01-01T00:00:00Z","gameDateTimeUTC":"2026-06-10T00:00:00Z","awayTeamTime":"2026-06-09T20:00:00Z","homeTeamTime":"2026-06-09T19:00:00Z","day":"Tue","monthNum":6,"weekNumber":0,"weekName":"","ifNecessary":false,"seriesGameNumber":"","gameLabel":"Commissioner's Cup","gameSubLabel":"","seriesText":"","arenaName":"Wintrust Arena","arenaState":"IL","arenaCity":"Chicago","postponedStatus":"N","branchLink":"","gameSubtype":"Commissioner","isNeutral":false,"broadcasters":{"nationalBroadcasters":[],"nationalRadioBroadcasters":[],"nationalOttBroadcasters":[],"homeTvBroadcasters":[],"homeRadioBroadcasters":[],"homeOttBroadcasters":[],"awayTvBroadcasters":[],"awayRadioBroadcasters":[],"awayOttBroadcasters":[]},"homeTeam":{"teamId":1611661329,"teamName":"Sky","teamCity":"Chicago","teamTricode":"CHI","teamSlug":"sky","wins":0,"losses":0,"score":0,"seed":0},"awayTeam":{"teamId":1611661330,"teamName":"Dream","teamCity":"Atlanta","teamTricode":"ATL","teamSlug":"dream","wins":0,"losses":0,"score":0,"seed":0},"pointsLeaders":[]},{"gameId":"1022600087","gameCode":"20260609/DALMIN","gameStatus":1,"gameStatusText":"8:00 pm ET","gameSequence":2,"gameDateEst":"2026-06-09T00:00:00Z","gameTimeEst":"1900-01-01T20:00:00Z","gameDateTimeEst":"2026-06-09T20:00:00Z","gameDateUTC":"2026-06-09T04:00:00Z","gameTimeUTC":"1900-01-01T00:00:00Z","gameDateTimeUTC":"2026-06-10T00:00:00Z","awayTeamTime":"2026-06-09T19:00:00Z","homeTeamTime":"2026-06-09T19:00:00Z","day":"Tue","monthNum":6,"weekNumber":0,"weekName":"","ifNecessary":false,"seriesGameNumber":"","gameLabel":"Commissioner's Cup","gameSubLabel":"","seriesText":"","arenaName":"Target Center","arenaState":"MN","arenaCity":"Minneapolis","postponedStatus":"N","branchLink":"","gameSubtype":"Commissioner","isNeutral":false,"broadcasters":{"nationalBroadcasters":[],"nationalRadioBroadcasters":[],"nationalOttBroadcasters":[],"homeTvBroadcasters":[],"homeRadioBroadcasters":[],"homeOttBroadcasters":[],"awayTvBroadcasters":[],"awayRadioBroadcasters":[],"awayOttBroadcasters":[]},"homeTeam":{"teamId":1611661324,"teamName":"Lynx","teamCity":"Minnesota","teamTricode":"MIN","teamSlug":"lynx","wins":0,"losses":0,"score":0,"seed":0},"awayTeam":{"teamId":1611661321,"teamName":"Wings","teamCity":"Dallas","teamTricode":"DAL","teamSlug":"wings","wins":0,"losses":0,"score":0,"seed":0},"pointsLeaders":[]},{"gameId":"1022600088","gameCode":"20260609/PHXGSV","gameStatus":1,"gameStatusText":"10:00 pm ET","gameSequence":3,"gameDateEst":"2026-06-09T00:00:00Z","gameTimeEst":"1900-01-01T22:00:00Z","gameDateTimeEst":"2026-06-09T22:00:00Z","gameDateUTC":"2026-06-09T04:00:00Z","gameTimeUTC":"1900-01-01T02:00:00Z","gameDateTimeUTC":"2026-06-10T02:00:00Z","awayTeamTime":"2026-06-09T19:00:00Z","homeTeamTime":"2026-06-09T19:00:00Z","day":"Tue","monthNum":6,"weekNumber":0,"weekName":"","ifNecessary":false,"seriesGameNumber":"","gameLabel":"Commissioner's Cup","gameSubLabel":"","seriesText":"","arenaName":"Chase Center","arenaState":"CA","arenaCity":"San Francisco","postponedStatus":"N","branchLink":"","gameSubtype":"Commissioner","isNeutral":false,"broadcasters":{"nationalBroadcasters":[],"nationalRadioBroadcasters":[],"nationalOttBroadcasters":[],"homeTvBroadcasters":[],"homeRadioBroadcasters":[],"homeOttBroadcasters":[],"awayTvBroadcasters":[],"awayRadioBroadcasters":[],"awayOttBroadcasters":[]},"homeTeam":{"teamId":1611661331,"teamName":"Valkyries","teamCity":"Golden State","teamTricode":"GSV","teamSlug":"valkyries","wins":0,"losses":0,"score":0,"seed":0},"awayTeam":{"teamId":1611661317,"teamName":"Mercury","teamCity":"Phoenix","teamTricode":"PHX","teamSlug":"mercury","wins":0,"losses":0,"score":0,"seed":0},"pointsLeaders":[]}]},{"gameDate":"06/10/2026 00:00:00","games":[{"gameId":"1022600090","gameCode":"20260610/LASSEA","gameStatus":1,"gameStatusText":"10:00 pm ET","gameSequence":2,"gameDateEst":"2026-06-10T00:00:00Z","gameTimeEst":"1900-01-01T22:00:00Z","gameDateTimeEst":"2026-06-10T22:00:00Z","gameDateUTC":"2026-06-10T04:00:00Z","gameTimeUTC":"1900-01-01T02:00:00Z","gameDateTimeUTC":"2026-06-11T02:00:00Z","awayTeamTime":"2026-06-10T19:00:00Z","homeTeamTime":"2026-06-10T19:00:00Z","day":"Wed","monthNum":6,"weekNumber":0,"weekName":"","ifNecessary":false,"seriesGameNumber":"","gameLabel":"Commissioner's Cup","gameSubLabel":"","seriesText":"","arenaName":"Climate Pledge Arena","arenaState":"WA","arenaCity":"Seattle","postponedStatus":"N","branchLink":"","gameSubtype":"Commissioner","isNeutral":false,"broadcasters":{"nationalBroadcasters":[],"nationalRadioBroadcasters":[],"nationalOttBroadcasters":[],"homeTvBroadcasters":[],"homeRadioBroadcasters":[],"homeOttBroadcasters":[],"awayTvBroadcasters":[],"awayRadioBroadcasters":[],"awayOttBroadcasters":[]},"homeTeam":{"teamId":1611661328,"teamName":"Storm","teamCity":"Seattle","teamTricode":"SEA","teamSlug":"storm","wins":0,"losses":0,"score":0,"seed":0},"awayTeam":{"teamId":1611661320,"teamName":"Sparks","teamCity":"Los Angeles","teamTricode":"LAS","teamSlug":"sparks","wins":0,"losses":0,"score":0,"seed":0},"pointsLeaders":[]}]},{"gameDate":"06/11/2026 00:00:00","games":[{"gameId":"1022600091","gameCode":"20260611/CHIIND","gameStatus":1,"gameStatusText":"7:00 pm ET","gameSequence":1,"gameDateEst":"2026-06-11T00:00:00Z","gameTimeEst":"1900-01-01T19:00:00Z","gameDateTimeEst":"2026-06-11T19:00:00Z","gameDateUTC":"2026-06-11T04:00:00Z","gameTimeUTC":"1900-01-01T23:00:00Z","gameDateTimeUTC":"2026-06-11T23:00:00Z","awayTeamTime":"2026-06-11T18:00:00Z","homeTeamTime":"2026-06-11T19:00:00Z","day":"Thu","monthNum":6,"weekNumber":0,"weekName":"","ifNecessary":false,"seriesGameNumber":"","gameLabel":"Commissioner's Cup","gameSubLabel":"","seriesText":"","arenaName":"Gainbridge Fieldhouse","arenaState":"IN","arenaCity":"Indianapolis","postponedStatus":"N","branchLink":"","gameSubtype":"Commissioner","isNeutral":false,"broadcasters":{"nationalBroadcasters":[],"nationalRadioBroadcasters":[],"nationalOttBroadcasters":[],"homeTvBroadcasters":[],"homeRadioBroadcasters":[],"homeOttBroadcasters":[],"awayTvBroadcasters":[],"awayRadioBroadcasters":[],"awayOttBroadcasters":[]},"homeTeam":{"teamId":1611661325,"teamName":"Fever","teamCity":"Indiana","teamTricode":"IND","teamSlug":"fever","wins":0,"losses":0,"score":0,"seed":0},"awayTeam":{"teamId":1611661329,"teamName":"Sky","teamCity":"Chicago","teamTricode":"CHI","teamSlug":"sky","wins":0,"losses":0,"score":0,"seed":0},"pointsLeaders":[]},{"gameId":"1022600092","gameCode":"20260611/NYLATL","gameStatus":1,"gameStatusText":"7:30 pm ET","gameSequence":2,"gameDateEst":"2026-06-11T00:00:00Z","gameTimeEst":"1900-01-01T19:30:00Z","gameDateTimeEst":"2026-06-11T19:30:00Z","gameDateUTC":"2026-06-11T04:00:00Z","gameTimeUTC":"1900-01-01T23:30:00Z","gameDateTimeUTC":"2026-06-11T23:30:00Z","awayTeamTime":"2026-06-11T19:30:00Z","homeTeamTime":"2026-06-11T19:30:00Z","day":"Thu","monthNum":6,"weekNumber":0,"weekName":"","ifNecessary":false,"seriesGameNumber":"","gameLabel":"Commissioner's Cup","gameSubLabel":"","seriesText":"","arenaName":"Gateway Center Arena @ College Park","arenaState":"GA","arenaCity":"Atlanta","postponedStatus":"N","branchLink":"","gameSubtype":"Commissioner","isNeutral":false,"broadcasters":{"nationalBroadcasters":[],"nationalRadioBroadcasters":[],"nationalOttBroadcasters":[],"homeTvBroadcasters":[],"homeRadioBroadcasters":[],"homeOttBroadcasters":[],"awayTvBroadcasters":[],"awayRadioBroadcasters":[],"awayOttBroadcasters":[]},"homeTeam":{"teamId":1611661330,"teamName":"Dream","teamCity":"Atlanta","teamTricode":"ATL","teamSlug":"dream","wins":0,"losses":0,"score":0,"seed":0},"awayTeam":{"teamId":1611661313,"teamName":"Liberty","teamCity":"New York","teamTricode":"NYL","teamSlug":"liberty","wins":0,"losses":0,"score":0,"seed":0},"pointsLeaders":[]},{"gameId":"1022600093","gameCode":"20260611/PHXDAL","gameStatus":1,"gameStatusText":"9:00 pm ET","gameSequence":3,"gameDateEst":"2026-06-11T00:00:00Z","gameTimeEst":"1900-01-01T21:00:00Z","gameDateTimeEst":"2026-06-11T21:00:00Z","gameDateUTC":"2026-06-11T04:00:00Z","gameTimeUTC":"1900-01-01T01:00:00Z","gameDateTimeUTC":"2026-06-12T01:00:00Z","awayTeamTime":"2026-06-11T18:00:00Z","homeTeamTime":"2026-06-11T20:00:00Z","day":"Thu","monthNum":6,"weekNumber":0,"weekName":"","ifNecessary":false,"seriesGameNumber":"","gameLabel":"Commissioner's Cup","gameSubLabel":"","seriesText":"","arenaName":"College Park Center","arenaState":"TX","arenaCity":"Arlington","postponedStatus":"N","branchLink":"","gameSubtype":"Commissioner","isNeutral":false,"broadcasters":{"nationalBroadcasters":[],"nationalRadioBroadcasters":[],"nationalOttBroadcasters":[],"homeTvBroadcasters":[],"homeRadioBroadcasters":[],"homeOttBroadcasters":[],"awayTvBroadcasters":[],"awayRadioBroadcasters":[],"awayOttBroadcasters":[]},"homeTeam":{"teamId":1611661321,"teamName":"Wings","teamCity":"Dallas","teamTricode":"DAL","teamSlug":"wings","wins":0,"losses":0,"score":0,"seed":0},"awayTeam":{"teamId":1611661317,"teamName":"Mercury","teamCity":"Phoenix","teamTricode":"PHX","teamSlug":"mercury","wins":0,"losses":0,"score":0,"seed":0},"pointsLeaders":[]}]},{"gameDate":"06/12/2026 00:00:00","games":[{"gameId":"1022600096","gameCode":"20260612/GSVSEA","gameStatus":1,"gameStatusText":"10:00 pm ET","gameSequence":2,"gameDateEst":"2026-06-12T00:00:00Z","gameTimeEst":"1900-01-01T22:00:00Z","gameDateTimeEst":"2026-06-12T22:00:00Z","gameDateUTC":"2026-06-12T04:00:00Z","gameTimeUTC":"1900-01-01T02:00:00Z","gameDateTimeUTC":"2026-06-13T02:00:00Z","awayTeamTime":"2026-06-12T19:00:00Z","homeTeamTime":"2026-06-12T19:00:00Z","day":"Fri","monthNum":6,"weekNumber":0,"weekName":"","ifNecessary":false,"seriesGameNumber":"","gameLabel":"Commissioner's Cup","gameSubLabel":"","seriesText":"","arenaName":"Climate Pledge Arena","arenaState":"WA","arenaCity":"Seattle","postponedStatus":"N","branchLink":"","gameSubtype":"Commissioner","isNeutral":false,"broadcasters":{"nationalBroadcasters":[],"nationalRadioBroadcasters":[],"nationalOttBroadcasters":[],"homeTvBroadcasters":[],"homeRadioBroadcasters":[],"homeOttBroadcasters":[],"awayTvBroadcasters":[],"awayRadioBroadcasters":[],"awayOttBroadcasters":[]},"homeTeam":{"teamId":1611661328,"teamName":"Storm","teamCity":"Seattle","teamTricode":"SEA","teamSlug":"storm","wins":0,"losses":0,"score":0,"seed":0},"awayTeam":{"teamId":1611661331,"teamName":"Valkyries","teamCity":"Golden State","teamTricode":"GSV","teamSlug":"valkyries","wins":0,"losses":0,"score":0,"seed":0},"pointsLeaders":[]}]},{"gameDate":"06/13/2026 00:00:00","games":[{"gameId":"1022600097","gameCode":"20260613/INDCON","gameStatus":1,"gameStatusText":"6:00 pm ET","gameSequence":1,"gameDateEst":"2026-06-13T00:00:00Z","gameTimeEst":"1900-01-01T18:00:00Z","gameDateTimeEst":"2026-06-13T18:00:00Z","gameDateUTC":"2026-06-13T04:00:00Z","gameTimeUTC":"1900-01-01T22:00:00Z","gameDateTimeUTC":"2026-06-13T22:00:00Z","awayTeamTime":"2026-06-13T18:00:00Z","homeTeamTime":"2026-06-13T18:00:00Z","day":"Sat","monthNum":6,"weekNumber":0,"weekName":"","ifNecessary":false,"seriesGameNumber":"","gameLabel":"Commissioner's Cup","gameSubLabel":"","seriesText":"","arenaName":"Mohegan Sun Arena","arenaState":"CT","arenaCity":"Uncasville","postponedStatus":"N","branchLink":"","gameSubtype":"Commissioner","isNeutral":false,"broadcasters":{"nationalBroadcasters":[],"nationalRadioBroadcasters":[],"nationalOttBroadcasters":[],"homeTvBroadcasters":[],"homeRadioBroadcasters":[],"homeOttBroadcasters":[],"awayTvBroadcasters":[],"awayRadioBroadcasters":[],"awayOttBroadcasters":[]},"homeTeam":{"teamId":1611661323,"teamName":"Sun","teamCity":"Connecticut","teamTricode":"CON","teamSlug":"sun","wins":0,"losses":0,"score":0,"seed":0},"awayTeam":{"teamId":1611661325,"teamName":"Fever","teamCity":"Indiana","teamTricode":"IND","teamSlug":"fever","wins":0,"losses":0,"score":0,"seed":0},"pointsLeaders":[]},{"gameId":"1022600098","gameCode":"20260613/MINLVA","gameStatus":1,"gameStatusText":"8:00 pm ET","gameSequence":2,"gameDateEst":"2026-06-13T00:00:00Z","gameTimeEst":"1900-01-01T20:00:00Z","gameDateTimeEst":"2026-06-13T20:00:00Z","gameDateUTC":"2026-06-13T04:00:00Z","gameTimeUTC":"1900-01-01T00:00:00Z","gameDateTimeUTC":"2026-06-14T00:00:00Z","awayTeamTime":"2026-06-13T19:00:00Z","homeTeamTime":"2026-06-13T17:00:00Z","day":"Sat","monthNum":6,"weekNumber":0,"weekName":"","ifNecessary":false,"seriesGameNumber":"","gameLabel":"Commissioner's Cup","gameSubLabel":"","seriesText":"","arenaName":"Michelob ULTRA Arena","arenaState":"NV","arenaCity":"Las Vegas","postponedStatus":"N","branchLink":"","gameSubtype":"Commissioner","isNeutral":false,"broadcasters":{"nationalBroadcasters":[],"nationalRadioBroadcasters":[],"nationalOttBroadcasters":[],"homeTvBroadcasters":[],"homeRadioBroadcasters":[],"homeOttBroadcasters":[],"awayTvBroadcasters":[],"awayRadioBroadcasters":[],"awayOttBroadcasters":[]},"homeTeam":{"teamId":1611661319,"teamName":"Aces","teamCity":"Las Vegas","teamTricode":"LVA","teamSlug":"aces","wins":0,"losses":0,"score":0,"seed":0},"awayTeam":{"teamId":1611661324,"teamName":"Lynx","teamCity":"Minnesota","teamTricode":"MIN","teamSlug":"lynx","wins":0,"losses":0,"score":0,"seed":0},"pointsLeaders":[]},{"gameId":"1022600100","gameCode":"20260613/LASPHX","gameStatus":1,"gameStatusText":"10:00 pm ET","gameSequence":4,"gameDateEst":"2026-06-13T00:00:00Z","gameTimeEst":"1900-01-01T22:00:00Z","gameDateTimeEst":"2026-06-13T22:00:00Z","gameDateUTC":"2026-06-13T04:00:00Z","gameTimeUTC":"1900-01-01T02:00:00Z","gameDateTimeUTC":"2026-06-14T02:00:00Z","awayTeamTime":"2026-06-13T19:00:00Z","homeTeamTime":"2026-06-13T19:00:00Z","day":"Sat","monthNum":6,"weekNumber":0,"weekName":"","ifNecessary":false,"seriesGameNumber":"","gameLabel":"Commissioner's Cup","gameSubLabel":"","seriesText":"","arenaName":"Mortgage Matchup Center","arenaState":"AZ","arenaCity":"Phoenix","postponedStatus":"N","branchLink":"","gameSubtype":"Commissioner","isNeutral":false,"broadcasters":{"nationalBroadcasters":[],"nationalRadioBroadcasters":[],"nationalOttBroadcasters":[],"homeTvBroadcasters":[],"homeRadioBroadcasters":[],"homeOttBroadcasters":[],"awayTvBroadcasters":[],"awayRadioBroadcasters":[],"awayOttBroadcasters":[]},"homeTeam":{"teamId":1611661317,"teamName":"Mercury","teamCity":"Phoenix","teamTricode":"PHX","teamSlug":"mercury","wins":0,"losses":0,"score":0,"seed":0},"awayTeam":{"teamId":1611661320,"teamName":"Sparks","teamCity":"Los Angeles","teamTricode":"LAS","teamSlug":"sparks","wins":0,"losses":0,"score":0,"seed":0},"pointsLeaders":[]}]},{"gameDate":"06/14/2026 00:00:00","games":[{"gameId":"1022600101","gameCode":"20260614/WASNYL","gameStatus":1,"gameStatusText":"3:00 pm ET","gameSequence":1,"gameDateEst":"2026-06-14T00:00:00Z","gameTimeEst":"1900-01-01T15:00:00Z","gameDateTimeEst":"2026-06-14T15:00:00Z","gameDateUTC":"2026-06-14T04:00:00Z","gameTimeUTC":"1900-01-01T19:00:00Z","gameDateTimeUTC":"2026-06-14T19:00:00Z","awayTeamTime":"2026-06-14T15:00:00Z","homeTeamTime":"2026-06-14T15:00:00Z","day":"Sun","monthNum":6,"weekNumber":0,"weekName":"","ifNecessary":false,"seriesGameNumber":"","gameLabel":"Commissioner's Cup","gameSubLabel":"","seriesText":"","arenaName":"Barclays Center","arenaState":"NY","arenaCity":"Brooklyn","postponedStatus":"N","branchLink":"","gameSubtype":"Commissioner","isNeutral":false,"broadcasters":{"nationalBroadcasters":[],"nationalRadioBroadcasters":[],"nationalOttBroadcasters":[],"homeTvBroadcasters":[],"homeRadioBroadcasters":[],"homeOttBroadcasters":[],"awayTvBroadcasters":[],"awayRadioBroadcasters":[],"awayOttBroadcasters":[]},"homeTeam":{"teamId":1611661313,"teamName":"Liberty","teamCity":"New York","teamTricode":"NYL","teamSlug":"liberty","wins":0,"losses":0,"score":0,"seed":0},"awayTeam":{"teamId":1611661322,"teamName":"Mystics","teamCity":"Washington","teamTricode":"WAS","teamSlug":"mystics","wins":0,"losses":0,"score":0,"seed":0},"pointsLeaders":[]}]},{"gameDate":"06/15/2026 00:00:00","games":[{"gameId":"1022600103","gameCode":"20260615/LVADAL","gameStatus":1,"gameStatusText":"8:00 pm ET","gameSequence":1,"gameDateEst":"2026-06-15T00:00:00Z","gameTimeEst":"1900-01-01T20:00:00Z","gameDateTimeEst":"2026-06-15T20:00:00Z","gameDateUTC":"2026-06-15T04:00:00Z","gameTimeUTC":"1900-01-01T00:00:00Z","gameDateTimeUTC":"2026-06-16T00:00:00Z","awayTeamTime":"2026-06-15T17:00:00Z","homeTeamTime":"2026-06-15T19:00:00Z","day":"Mon","monthNum":6,"weekNumber":0,"weekName":"","ifNecessary":false,"seriesGameNumber":"","gameLabel":"Commissioner's Cup","gameSubLabel":"","seriesText":"","arenaName":"College Park Center","arenaState":"TX","arenaCity":"Arlington","postponedStatus":"N","branchLink":"","gameSubtype":"Commissioner","isNeutral":false,"broadcasters":{"nationalBroadcasters":[],"nationalRadioBroadcasters":[],"nationalOttBroadcasters":[],"homeTvBroadcasters":[],"homeRadioBroadcasters":[],"homeOttBroadcasters":[],"awayTvBroadcasters":[],"awayRadioBroadcasters":[],"awayOttBroadcasters":[]},"homeTeam":{"teamId":1611661321,"teamName":"Wings","teamCity":"Dallas","teamTricode":"DAL","teamSlug":"wings","wins":0,"losses":0,"score":0,"seed":0},"awayTeam":{"teamId":1611661319,"teamName":"Aces","teamCity":"Las Vegas","teamTricode":"LVA","teamSlug":"aces","wins":0,"losses":0,"score":0,"seed":0},"pointsLeaders":[]},{"gameId":"1022600105","gameCode